[I 2025-10-16 14:28:49,051] Trial 81 finished with value: 0.8401374854111405 and parameters: {'num_conv_layers': 2, 'num_dense_layers': 1, 'conv_filters_0': 64, 'conv_kernel_0': 3, 'conv_activation_0': 'relu', 'use_bn_0': True, 'conv_dropout_0': 0.3, 'conv_filters_1': 32, 'conv_kernel_1': 5, 'conv_activation_1': 'swish', 'use_bn_1': True, 'conv_dropout_1': 0.2, 'pool_type_1': 'avg', 'global_pool': 'avg', 'dense_units_0': 32, 'dense_activation_0': 'relu', 'dense_dropout_0': 0.4}. Best is trial 69 with value: 0.8556293050397877.
Best trial: 69. Best value: 0.855629:  82%|███████████████████████████████▉       | 82/100 [42:30<11:26, 38.14s/it, 2550.39/3600 seconds]
🔍 Trial 82: Starting architecture search...
🔧 Applying data augmentation (factor: 3x)...
✅ Data augmentation completed: 1,758 → 5,274 samples
✅ Architecture valid: 12,292 params, 0.05MB
🚀 Training model...
Restoring model weights from the end of the best epoch: 46.
📊 Evaluating model...
⏱️  Measuring inference time...
📈 Results for Trial 82:
   Exact Match Accuracy: 0.966
   Average F1-Score: 0.989
   Parameters: 12,292
   Model Size: 0.05MB
   Inference Time: 29.39ms
   Combined Score: 0.851
[I 2025-10-16 14:29:29,542] Trial 82 finished with value: 0.8512780689655173 and parameters: {'num_conv_layers': 2, 'num_dense_layers': 1, 'conv_filters_0': 64, 'conv_kernel_0': 3, 'conv_activation_0': 'relu', 'use_bn_0': True, 'conv_dropout_0': 0.3, 'conv_filters_1': 32, 'conv_kernel_1': 5, 'conv_activation_1': 'swish', 'use_bn_1': True, 'conv_dropout_1': 0.2, 'pool_type_1': 'avg', 'global_pool': 'avg', 'dense_units_0': 32, 'dense_activation_0': 'relu', 'dense_dropout_0': 0.4}. Best is trial 69 with value: 0.8556293050397877.
Best trial: 69. Best value: 0.855629:  83%|████████████████████████████████▎      | 83/100 [43:10<11:00, 38.85s/it, 2590.88/3600 seconds]
🔍 Trial 83: Starting architecture search...
🔧 Applying data augmentation (factor: 3x)...
✅ Data augmentation completed: 1,758 → 5,274 samples
✅ Architecture valid: 12,292 params, 0.05MB
🚀 Training model...
Restoring model weights from the end of the best epoch: 48.
📊 Evaluating model...
⏱️  Measuring inference time...
📈 Results for Trial 83:
   Exact Match Accuracy: 0.971
   Average F1-Score: 0.991
   Parameters: 12,292
   Model Size: 0.05MB
   Inference Time: 30.60ms
   Combined Score: 0.855
[I 2025-10-16 14:30:15,803] Trial 83 finished with value: 0.8549915968169761 and parameters: {'num_conv_layers': 2, 'num_dense_layers': 1, 'conv_filters_0': 64, 'conv_kernel_0': 3, 'conv_activation_0': 'relu', 'use_bn_0': True, 'conv_dropout_0': 0.3, 'conv_filters_1': 32, 'conv_kernel_1': 5, 'conv_activation_1': 'swish', 'use_bn_1': True, 'conv_dropout_1': 0.2, 'pool_type_1': 'avg', 'global_pool': 'avg', 'dense_units_0': 32, 'dense_activation_0': 'relu', 'dense_dropout_0': 0.4}. Best is trial 69 with value: 0.8556293050397877.
Best trial: 69. Best value: 0.855629:  84%|████████████████████████████████▊      | 84/100 [43:57<10:57, 41.07s/it, 2637.14/3600 seconds]
🔍 Trial 84: Starting architecture search...
🔧 Applying data augmentation (factor: 3x)...
✅ Data augmentation completed: 1,758 → 5,274 samples
✅ Architecture valid: 12,292 params, 0.05MB
🚀 Training model...
Restoring model weights from the end of the best epoch: 46.
📊 Evaluating model...
⏱️  Measuring inference time...
📈 Results for Trial 84:
   Exact Match Accuracy: 0.958
   Average F1-Score: 0.988
   Parameters: 12,292
   Model Size: 0.05MB
   Inference Time: 30.77ms
   Combined Score: 0.846
[I 2025-10-16 14:31:04,885] Trial 84 finished with value: 0.8457077771883289 and parameters: {'num_conv_layers': 2, 'num_dense_layers': 1, 'conv_filters_0': 64, 'conv_kernel_0': 3, 'conv_activation_0': 'relu', 'use_bn_0': True, 'conv_dropout_0': 0.3, 'conv_filters_1': 32, 'conv_kernel_1': 5, 'conv_activation_1': 'swish', 'use_bn_1': True, 'conv_dropout_1': 0.2, 'pool_type_1': 'avg', 'global_pool': 'avg', 'dense_units_0': 32, 'dense_activation_0': 'relu', 'dense_dropout_0': 0.4}. Best is trial 69 with value: 0.8556293050397877.
Best trial: 69. Best value: 0.855629:  85%|█████████████████████████████████▏     | 85/100 [44:46<10:52, 43.47s/it, 2686.22/3600 seconds]
🔍 Trial 85: Starting architecture search...
🔧 Applying data augmentation (factor: 3x)...
✅ Data augmentation completed: 1,758 → 5,274 samples
✅ Architecture valid: 23,716 params, 0.09MB
🚀 Training model...
Restoring model weights from the end of the best epoch: 47.
📊 Evaluating model...
⏱️  Measuring inference time...
📈 Results for Trial 85:
   Exact Match Accuracy: 0.950
   Average F1-Score: 0.985
   Parameters: 23,716
   Model Size: 0.09MB
   Inference Time: 34.29ms
   Combined Score: 0.817
[I 2025-10-16 14:32:10,251] Trial 85 finished with value: 0.8172894854111405 and parameters: {'num_conv_layers': 2, 'num_dense_layers': 1, 'conv_filters_0': 64, 'conv_kernel_0': 3, 'conv_activation_0': 'relu', 'use_bn_0': True, 'conv_dropout_0': 0.4, 'conv_filters_1': 64, 'conv_kernel_1': 5, 'conv_activation_1': 'swish', 'use_bn_1': True, 'conv_dropout_1': 0.2, 'pool_type_1': 'avg', 'global_pool': 'avg', 'dense_units_0': 32, 'dense_activation_0': 'relu', 'dense_dropout_0': 0.4}. Best is trial 69 with value: 0.8556293050397877.
Best trial: 69. Best value: 0.855629:  86%|█████████████████████████████████▌     | 86/100 [45:51<11:40, 50.04s/it, 2751.59/3600 seconds]
🔍 Trial 86: Starting architecture search...
🔧 Applying data augmentation (factor: 3x)...
✅ Data augmentation completed: 1,758 → 5,274 samples
✅ Architecture valid: 57,348 params, 0.22MB
🚀 Training model...

Epoch 37: ReduceLROnPlateau reducing learning rate to 0.0005000000237487257.
Restoring model weights from the end of the best epoch: 48.
📊 Evaluating model...
⏱️  Measuring inference time...
📈 Results for Trial 86:
   Exact Match Accuracy: 0.955
   Average F1-Score: 0.987
   Parameters: 57,348
   Model Size: 0.22MB
   Inference Time: 30.36ms
   Combined Score: 0.754
[I 2025-10-16 14:33:30,050] Trial 86 finished with value: 0.7537390132625994 and parameters: {'num_conv_layers': 2, 'num_dense_layers': 1, 'conv_filters_0': 64, 'conv_kernel_0': 3, 'conv_activation_0': 'relu', 'use_bn_0': True, 'conv_dropout_0': 0.3, 'conv_filters_1': 160, 'conv_kernel_1': 5, 'conv_activation_1': 'swish', 'use_bn_1': False, 'conv_dropout_1': 0.2, 'pool_type_1': 'avg', 'global_pool': 'avg', 'dense_units_0': 32, 'dense_activation_0': 'relu', 'dense_dropout_0': 0.4}. Best is trial 69 with value: 0.8556293050397877.
Best trial: 69. Best value: 0.855629:  87%|█████████████████████████████████▉     | 87/100 [47:11<12:46, 58.97s/it, 2831.39/3600 seconds]
🔍 Trial 87: Starting architecture search...
🔧 Applying data augmentation (factor: 3x)...
✅ Data augmentation completed: 1,758 → 5,274 samples
✅ Architecture valid: 53,124 params, 0.20MB
🚀 Training model...

Epoch 47: ReduceLROnPlateau reducing learning rate to 0.0005000000237487257.
Restoring model weights from the end of the best epoch: 49.
📊 Evaluating model...
⏱️  Measuring inference time...
📈 Results for Trial 87:
   Exact Match Accuracy: 0.966
   Average F1-Score: 0.996
   Parameters: 53,124
   Model Size: 0.20MB
   Inference Time: 30.41ms
   Combined Score: 0.770
[I 2025-10-16 14:34:40,261] Trial 87 finished with value: 0.7696140689655173 and parameters: {'num_conv_layers': 4, 'num_dense_layers': 1, 'conv_filters_0': 64, 'conv_kernel_0': 9, 'conv_activation_0': 'relu', 'use_bn_0': True, 'conv_dropout_0': 0.5, 'conv_filters_1': 32, 'conv_kernel_1': 5, 'conv_activation_1': 'swish', 'use_bn_1': True, 'conv_dropout_1': 0.2, 'pool_type_1': 'avg', 'conv_filters_2': 64, 'conv_kernel_2': 9, 'conv_activation_2': 'relu', 'use_bn_2': False, 'conv_dropout_2': 0.3, 'conv_filters_3': 64, 'conv_kernel_3': 5, 'conv_activation_3': 'relu', 'use_bn_3': False, 'conv_dropout_3': 0.3, 'pool_type_3': 'max', 'global_pool': 'avg', 'dense_units_0': 32, 'dense_activation_0': 'relu', 'dense_dropout_0': 0.4}. Best is trial 69 with value: 0.8556293050397877.
Best trial: 69. Best value: 0.855629:  88%|██████████████████████████████████▎    | 88/100 [48:21<12:28, 62.34s/it, 2901.61/3600 seconds]
🔍 Trial 88: Starting architecture search...
🔧 Applying data augmentation (factor: 3x)...
✅ Data augmentation completed: 1,758 → 5,274 samples
❌ Too many parameters: 103,316 > 100,000
[I 2025-10-16 14:34:41,025] Trial 88 pruned.                                                                                             
Best trial: 69. Best value: 0.855629:  89%|██████████████████████████████████▋    | 89/100 [48:22<08:02, 43.87s/it, 2902.36/3600 seconds]
🔍 Trial 89: Starting architecture search...
🔧 Applying data augmentation (factor: 3x)...
✅ Data augmentation completed: 1,758 → 5,274 samples
✅ Architecture valid: 15,844 params, 0.06MB
🚀 Training model...

Epoch 44: ReduceLROnPlateau reducing learning rate to 0.0005000000237487257.
Restoring model weights from the end of the best epoch: 47.
📊 Evaluating model...
⏱️  Measuring inference time...
📈 Results for Trial 89:
   Exact Match Accuracy: 0.960
   Average F1-Score: 0.993
   Parameters: 15,844
   Model Size: 0.06MB
   Inference Time: 28.56ms
   Combined Score: 0.840
[I 2025-10-16 14:35:33,789] Trial 89 finished with value: 0.8404605411140583 and parameters: {'num_conv_layers': 2, 'num_dense_layers': 1, 'conv_filters_0': 64, 'conv_kernel_0': 3, 'conv_activation_0': 'relu', 'use_bn_0': True, 'conv_dropout_0': 0.3, 'conv_filters_1': 32, 'conv_kernel_1': 5, 'conv_activation_1': 'swish', 'use_bn_1': True, 'conv_dropout_1': 0.2, 'pool_type_1': 'avg', 'global_pool': 'avg', 'dense_units_0': 128, 'dense_activation_0': 'leaky_relu', 'dense_dropout_0': 0.4}. Best is trial 69 with value: 0.8556293050397877.
Best trial: 69. Best value: 0.855629:  90%|███████████████████████████████████    | 90/100 [49:15<07:45, 46.54s/it, 2955.13/3600 seconds]
🔍 Trial 90: Starting architecture search...
🔧 Applying data augmentation (factor: 3x)...
✅ Data augmentation completed: 1,758 → 5,274 samples
✅ Architecture valid: 20,372 params, 0.08MB
🚀 Training model...

Epoch 35: ReduceLROnPlateau reducing learning rate to 0.0005000000237487257.

Epoch 47: ReduceLROnPlateau reducing learning rate to 0.0002500000118743628.
Restoring model weights from the end of the best epoch: 49.
📊 Evaluating model...
⏱️  Measuring inference time...
📈 Results for Trial 90:
   Exact Match Accuracy: 0.942
   Average F1-Score: 0.983
   Parameters: 20,372
   Model Size: 0.08MB
   Inference Time: 27.67ms
   Combined Score: 0.818
[I 2025-10-16 14:36:14,422] Trial 90 finished with value: 0.8184071936339523 and parameters: {'num_conv_layers': 2, 'num_dense_layers': 3, 'conv_filters_0': 48, 'conv_kernel_0': 3, 'conv_activation_0': 'relu', 'use_bn_0': True, 'conv_dropout_0': 0.3, 'conv_filters_1': 32, 'conv_kernel_1': 5, 'conv_activation_1': 'leaky_relu', 'use_bn_1': True, 'conv_dropout_1': 0.5, 'pool_type_1': 'avg', 'global_pool': 'avg', 'dense_units_0': 32, 'dense_activation_0': 'relu', 'dense_dropout_0': 0.4, 'dense_units_1': 64, 'dense_activation_1': 'relu', 'dense_dropout_1': 0.5, 'dense_units_2': 128, 'dense_activation_2': 'relu', 'dense_dropout_2': 0.3}. Best is trial 69 with value: 0.8556293050397877.
Best trial: 69. Best value: 0.855629:  91%|███████████████████████████████████▍   | 91/100 [49:55<06:42, 44.77s/it, 2995.76/3600 seconds]
🔍 Trial 91: Starting architecture search...
🔧 Applying data augmentation (factor: 3x)...
✅ Data augmentation completed: 1,758 → 5,274 samples
✅ Architecture valid: 9,188 params, 0.04MB
🚀 Training model...

Epoch 45: ReduceLROnPlateau reducing learning rate to 0.0005000000237487257.
Restoring model weights from the end of the best epoch: 47.
📊 Evaluating model...
⏱️  Measuring inference time...
📈 Results for Trial 91:
   Exact Match Accuracy: 0.958
   Average F1-Score: 0.990
   Parameters: 9,188
   Model Size: 0.04MB
   Inference Time: 26.93ms
   Combined Score: 0.852
[I 2025-10-16 14:36:45,034] Trial 91 finished with value: 0.8519157771883289 and parameters: {'num_conv_layers': 2, 'num_dense_layers': 1, 'conv_filters_0': 32, 'conv_kernel_0': 3, 'conv_activation_0': 'relu', 'use_bn_0': True, 'conv_dropout_0': 0.3, 'conv_filters_1': 32, 'conv_kernel_1': 5, 'conv_activation_1': 'relu', 'use_bn_1': True, 'conv_dropout_1': 0.2, 'pool_type_1': 'avg', 'global_pool': 'avg', 'dense_units_0': 96, 'dense_activation_0': 'relu', 'dense_dropout_0': 0.5}. Best is trial 69 with value: 0.8556293050397877.
Best trial: 69. Best value: 0.855629:  92%|███████████████████████████████████▉   | 92/100 [50:26<05:24, 40.52s/it, 3026.37/3600 seconds]
🔍 Trial 92: Starting architecture search...
🔧 Applying data augmentation (factor: 3x)...
✅ Data augmentation completed: 1,758 → 5,274 samples
✅ Architecture valid: 9,188 params, 0.04MB
🚀 Training model...
Restoring model weights from the end of the best epoch: 49.
📊 Evaluating model...
⏱️  Measuring inference time...
📈 Results for Trial 92:
   Exact Match Accuracy: 0.952
   Average F1-Score: 0.989
   Parameters: 9,188
   Model Size: 0.04MB
   Inference Time: 28.03ms
   Combined Score: 0.848
[I 2025-10-16 14:37:15,766] Trial 92 finished with value: 0.84820224933687 and parameters: {'num_conv_layers': 2, 'num_dense_layers': 1, 'conv_filters_0': 32, 'conv_kernel_0': 3, 'conv_activation_0': 'relu', 'use_bn_0': True, 'conv_dropout_0': 0.3, 'conv_filters_1': 32, 'conv_kernel_1': 5, 'conv_activation_1': 'swish', 'use_bn_1': True, 'conv_dropout_1': 0.2, 'pool_type_1': 'avg', 'global_pool': 'avg', 'dense_units_0': 96, 'dense_activation_0': 'relu', 'dense_dropout_0': 0.5}. Best is trial 69 with value: 0.8556293050397877.
Best trial: 69. Best value: 0.855629:  93%|████████████████████████████████████▎  | 93/100 [50:57<04:23, 37.58s/it, 3057.10/3600 seconds]
🔍 Trial 93: Starting architecture search...
🔧 Applying data augmentation (factor: 3x)...
✅ Data augmentation completed: 1,758 → 5,274 samples
✅ Architecture valid: 25,604 params, 0.10MB
🚀 Training model...

Epoch 31: ReduceLROnPlateau reducing learning rate to 0.0005000000237487257.
Restoring model weights from the end of the best epoch: 44.
📊 Evaluating model...
⏱️  Measuring inference time...
📈 Results for Trial 93:
   Exact Match Accuracy: 0.976
   Average F1-Score: 0.992
   Parameters: 25,604
   Model Size: 0.10MB
   Inference Time: 29.94ms
   Combined Score: 0.832
[I 2025-10-16 14:38:18,915] Trial 93 finished with value: 0.832081124668435 and parameters: {'num_conv_layers': 2, 'num_dense_layers': 1, 'conv_filters_0': 128, 'conv_kernel_0': 3, 'conv_activation_0': 'relu', 'use_bn_0': True, 'conv_dropout_0': 0.3, 'conv_filters_1': 32, 'conv_kernel_1': 5, 'conv_activation_1': 'relu', 'use_bn_1': True, 'conv_dropout_1': 0.2, 'pool_type_1': 'avg', 'global_pool': 'avg', 'dense_units_0': 96, 'dense_activation_0': 'relu', 'dense_dropout_0': 0.4}. Best is trial 69 with value: 0.8556293050397877.
Best trial: 69. Best value: 0.855629:  94%|████████████████████████████████████▋  | 94/100 [52:00<04:31, 45.25s/it, 3120.25/3600 seconds]
🔍 Trial 94: Starting architecture search...
🔧 Applying data augmentation (factor: 3x)...
✅ Data augmentation completed: 1,758 → 5,274 samples
✅ Architecture valid: 9,188 params, 0.04MB
🚀 Training model...

Epoch 44: ReduceLROnPlateau reducing learning rate to 0.0005000000237487257.
Restoring model weights from the end of the best epoch: 46.
📊 Evaluating model...
⏱️  Measuring inference time...
📈 Results for Trial 94:
   Exact Match Accuracy: 0.950
   Average F1-Score: 0.985
   Parameters: 9,188
   Model Size: 0.04MB
   Inference Time: 28.22ms
   Combined Score: 0.846
[I 2025-10-16 14:38:51,237] Trial 94 finished with value: 0.8463454854111405 and parameters: {'num_conv_layers': 2, 'num_dense_layers': 1, 'conv_filters_0': 32, 'conv_kernel_0': 3, 'conv_activation_0': 'relu', 'use_bn_0': True, 'conv_dropout_0': 0.3, 'conv_filters_1': 32, 'conv_kernel_1': 5, 'conv_activation_1': 'relu', 'use_bn_1': True, 'conv_dropout_1': 0.2, 'pool_type_1': 'avg', 'global_pool': 'avg', 'dense_units_0': 96, 'dense_activation_0': 'relu', 'dense_dropout_0': 0.5}. Best is trial 69 with value: 0.8556293050397877.
Best trial: 69. Best value: 0.855629:  95%|█████████████████████████████████████  | 95/100 [52:32<03:26, 41.37s/it, 3152.58/3600 seconds]
🔍 Trial 95: Starting architecture search...
🔧 Applying data augmentation (factor: 3x)...
✅ Data augmentation completed: 1,758 → 5,274 samples
✅ Architecture valid: 6,820 params, 0.03MB
🚀 Training model...
Restoring model weights from the end of the best epoch: 49.
📊 Evaluating model...
⏱️  Measuring inference time...
📈 Results for Trial 95:
   Exact Match Accuracy: 0.952
   Average F1-Score: 0.987
   Parameters: 6,820
   Model Size: 0.03MB
   Inference Time: 31.85ms
   Combined Score: 0.853
[I 2025-10-16 14:39:28,779] Trial 95 finished with value: 0.85293824933687 and parameters: {'num_conv_layers': 2, 'num_dense_layers': 1, 'conv_filters_0': 32, 'conv_kernel_0': 3, 'conv_activation_0': 'relu', 'use_bn_0': True, 'conv_dropout_0': 0.4, 'conv_filters_1': 32, 'conv_kernel_1': 5, 'conv_activation_1': 'gelu', 'use_bn_1': True, 'conv_dropout_1': 0.2, 'pool_type_1': 'avg', 'global_pool': 'avg', 'dense_units_0': 32, 'dense_activation_0': 'relu', 'dense_dropout_0': 0.5}. Best is trial 69 with value: 0.8556293050397877.
Best trial: 69. Best value: 0.855629:  96%|█████████████████████████████████████▍ | 96/100 [53:10<02:40, 40.22s/it, 3190.12/3600 seconds]
🔍 Trial 96: Starting architecture search...
🔧 Applying data augmentation (factor: 3x)...
✅ Data augmentation completed: 1,758 → 5,274 samples
❌ Too many parameters: 225,476 > 100,000
[I 2025-10-16 14:39:29,609] Trial 96 pruned.                                                                                             
Best trial: 69. Best value: 0.855629:  97%|█████████████████████████████████████▊ | 97/100 [53:10<01:25, 28.41s/it, 3190.95/3600 seconds]
🔍 Trial 97: Starting architecture search...
🔧 Applying data augmentation (factor: 3x)...
✅ Data augmentation completed: 1,758 → 5,274 samples
✅ Architecture valid: 25,604 params, 0.10MB
🚀 Training model...
❌ Trial 97 failed: Arguments `target` and `output` must have the same rank (ndim). Received: target.shape=(None, 4), output.shape=(None, 64, 4)
[I 2025-10-16 14:39:30,496] Trial 97 finished with value: 0.0 and parameters: {'num_conv_layers': 2, 'num_dense_layers': 1, 'conv_filters_0': 32, 'conv_kernel_0': 3, 'conv_activation_0': 'relu', 'use_bn_0': False, 'conv_dropout_0': 0.3, 'conv_filters_1': 128, 'conv_kernel_1': 5, 'conv_activation_1': 'gelu', 'use_bn_1': True, 'conv_dropout_1': 0.4, 'pool_type_1': 'avg', 'global_pool': 'adaptive', 'dense_units_0': 32, 'dense_activation_0': 'relu', 'dense_dropout_0': 0.5}. Best is trial 69 with value: 0.8556293050397877.
Best trial: 69. Best value: 0.855629:  98%|██████████████████████████████████████▏| 98/100 [53:11<00:40, 20.15s/it, 3191.83/3600 seconds]
🔍 Trial 98: Starting architecture search...
🔧 Applying data augmentation (factor: 3x)...
✅ Data augmentation completed: 1,758 → 5,274 samples
❌ Too many parameters: 173,252 > 100,000
[I 2025-10-16 14:39:31,238] Trial 98 pruned.                                                                                             
Best trial: 69. Best value: 0.855629:  99%|██████████████████████████████████████▌| 99/100 [53:12<00:14, 14.33s/it, 3192.58/3600 seconds]
🔍 Trial 99: Starting architecture search...
🔧 Applying data augmentation (factor: 3x)...
✅ Data augmentation completed: 1,758 → 5,274 samples
✅ Architecture valid: 6,820 params, 0.03MB
🚀 Training model...
Restoring model weights from the end of the best epoch: 47.
📊 Evaluating model...
⏱️  Measuring inference time...
📈 Results for Trial 99:
   Exact Match Accuracy: 0.942
   Average F1-Score: 0.982
   Parameters: 6,820
   Model Size: 0.03MB
   Inference Time: 30.91ms
   Combined Score: 0.846
