[I 2025-10-16 14:17:59,912] Trial 62 finished with value: 0.8426319575596817 and parameters: {'num_conv_layers': 2, 'num_dense_layers': 1, 'conv_filters_0': 32, 'conv_kernel_0': 3, 'conv_activation_0': 'swish', 'use_bn_0': True, 'conv_dropout_0': 0.3, 'conv_filters_1': 32, 'conv_kernel_1': 5, 'conv_activation_1': 'relu', 'use_bn_1': True, 'conv_dropout_1': 0.1, 'pool_type_1': 'avg', 'global_pool': 'avg', 'dense_units_0': 96, 'dense_activation_0': 'relu', 'dense_dropout_0': 0.5}. Best is trial 31 with value: 0.84820224933687.
Best trial: 31. Best value: 0.848202:  63%|████████████████████████▌              | 63/100 [31:41<21:18, 34.55s/it, 1901.25/3600 seconds]
🔍 Trial 63: Starting architecture search...
🔧 Applying data augmentation (factor: 3x)...
✅ Data augmentation completed: 1,758 → 5,274 samples
✅ Architecture valid: 9,188 params, 0.04MB
🚀 Training model...

Epoch 26: ReduceLROnPlateau reducing learning rate to 0.0005000000237487257.
Restoring model weights from the end of the best epoch: 48.
📊 Evaluating model...
⏱️  Measuring inference time...
📈 Results for Trial 63:
   Exact Match Accuracy: 0.936
   Average F1-Score: 0.982
   Parameters: 9,188
   Model Size: 0.04MB
   Inference Time: 29.39ms
   Combined Score: 0.837
[I 2025-10-16 14:18:37,642] Trial 63 finished with value: 0.8370616657824933 and parameters: {'num_conv_layers': 2, 'num_dense_layers': 1, 'conv_filters_0': 32, 'conv_kernel_0': 3, 'conv_activation_0': 'swish', 'use_bn_0': True, 'conv_dropout_0': 0.3, 'conv_filters_1': 32, 'conv_kernel_1': 5, 'conv_activation_1': 'relu', 'use_bn_1': True, 'conv_dropout_1': 0.1, 'pool_type_1': 'avg', 'global_pool': 'avg', 'dense_units_0': 96, 'dense_activation_0': 'relu', 'dense_dropout_0': 0.5}. Best is trial 31 with value: 0.84820224933687.
Best trial: 31. Best value: 0.848202:  64%|████████████████████████▉              | 64/100 [32:18<21:18, 35.50s/it, 1938.98/3600 seconds]
🔍 Trial 64: Starting architecture search...
🔧 Applying data augmentation (factor: 3x)...
✅ Data augmentation completed: 1,758 → 5,274 samples
✅ Architecture valid: 9,188 params, 0.04MB
🚀 Training model...

Epoch 40: ReduceLROnPlateau reducing learning rate to 0.0005000000237487257.
Restoring model weights from the end of the best epoch: 48.
📊 Evaluating model...
⏱️  Measuring inference time...
📈 Results for Trial 64:
   Exact Match Accuracy: 0.947
   Average F1-Score: 0.984
   Parameters: 9,188
   Model Size: 0.04MB
   Inference Time: 31.74ms
   Combined Score: 0.844
[I 2025-10-16 14:19:14,685] Trial 64 finished with value: 0.8444887214854111 and parameters: {'num_conv_layers': 2, 'num_dense_layers': 1, 'conv_filters_0': 32, 'conv_kernel_0': 3, 'conv_activation_0': 'swish', 'use_bn_0': True, 'conv_dropout_0': 0.3, 'conv_filters_1': 32, 'conv_kernel_1': 5, 'conv_activation_1': 'relu', 'use_bn_1': True, 'conv_dropout_1': 0.1, 'pool_type_1': 'avg', 'global_pool': 'avg', 'dense_units_0': 96, 'dense_activation_0': 'relu', 'dense_dropout_0': 0.5}. Best is trial 31 with value: 0.84820224933687.
Best trial: 31. Best value: 0.848202:  65%|█████████████████████████▎             | 65/100 [32:56<20:58, 35.97s/it, 1976.02/3600 seconds]
🔍 Trial 65: Starting architecture search...
🔧 Applying data augmentation (factor: 3x)...
✅ Data augmentation completed: 1,758 → 5,274 samples
✅ Architecture valid: 13,364 params, 0.05MB
🚀 Training model...

Epoch 22: ReduceLROnPlateau reducing learning rate to 0.0005000000237487257.
Restoring model weights from the end of the best epoch: 49.
📊 Evaluating model...
⏱️  Measuring inference time...
📈 Results for Trial 65:
   Exact Match Accuracy: 0.944
   Average F1-Score: 0.984
   Parameters: 13,364
   Model Size: 0.05MB
   Inference Time: 27.83ms
   Combined Score: 0.834
[I 2025-10-16 14:19:54,416] Trial 65 finished with value: 0.8342799575596817 and parameters: {'num_conv_layers': 2, 'num_dense_layers': 1, 'conv_filters_0': 32, 'conv_kernel_0': 3, 'conv_activation_0': 'swish', 'use_bn_0': True, 'conv_dropout_0': 0.3, 'conv_filters_1': 48, 'conv_kernel_1': 5, 'conv_activation_1': 'relu', 'use_bn_1': True, 'conv_dropout_1': 0.1, 'pool_type_1': 'avg', 'global_pool': 'avg', 'dense_units_0': 96, 'dense_activation_0': 'relu', 'dense_dropout_0': 0.5}. Best is trial 31 with value: 0.84820224933687.
Best trial: 31. Best value: 0.848202:  66%|█████████████████████████▋             | 66/100 [33:35<21:01, 37.10s/it, 2015.75/3600 seconds]
🔍 Trial 66: Starting architecture search...
🔧 Applying data augmentation (factor: 3x)...
✅ Data augmentation completed: 1,758 → 5,274 samples
✅ Architecture valid: 9,188 params, 0.04MB
🚀 Training model...

Epoch 50: ReduceLROnPlateau reducing learning rate to 0.0005000000237487257.
Restoring model weights from the end of the best epoch: 43.
📊 Evaluating model...
⏱️  Measuring inference time...
📈 Results for Trial 66:
   Exact Match Accuracy: 0.942
   Average F1-Score: 0.983
   Parameters: 9,188
   Model Size: 0.04MB
   Inference Time: 27.49ms
   Combined Score: 0.841
[I 2025-10-16 14:20:28,107] Trial 66 finished with value: 0.8407751936339523 and parameters: {'num_conv_layers': 2, 'num_dense_layers': 1, 'conv_filters_0': 32, 'conv_kernel_0': 3, 'conv_activation_0': 'swish', 'use_bn_0': True, 'conv_dropout_0': 0.5, 'conv_filters_1': 32, 'conv_kernel_1': 5, 'conv_activation_1': 'relu', 'use_bn_1': True, 'conv_dropout_1': 0.1, 'pool_type_1': 'avg', 'global_pool': 'avg', 'dense_units_0': 96, 'dense_activation_0': 'relu', 'dense_dropout_0': 0.5}. Best is trial 31 with value: 0.84820224933687.
Best trial: 31. Best value: 0.848202:  67%|██████████████████████████▏            | 67/100 [34:09<19:50, 36.07s/it, 2049.45/3600 seconds]
🔍 Trial 67: Starting architecture search...
🔧 Applying data augmentation (factor: 3x)...
✅ Data augmentation completed: 1,758 → 5,274 samples
✅ Architecture valid: 25,604 params, 0.10MB
🚀 Training model...

Epoch 26: ReduceLROnPlateau reducing learning rate to 0.0005000000237487257.
Restoring model weights from the end of the best epoch: 46.
📊 Evaluating model...
⏱️  Measuring inference time...
📈 Results for Trial 67:
   Exact Match Accuracy: 0.939
   Average F1-Score: 0.982
   Parameters: 25,604
   Model Size: 0.10MB
   Inference Time: 32.26ms
   Combined Score: 0.806
[I 2025-10-16 14:21:37,388] Trial 67 finished with value: 0.8060864297082229 and parameters: {'num_conv_layers': 2, 'num_dense_layers': 1, 'conv_filters_0': 128, 'conv_kernel_0': 3, 'conv_activation_0': 'swish', 'use_bn_0': True, 'conv_dropout_0': 0.4, 'conv_filters_1': 32, 'conv_kernel_1': 5, 'conv_activation_1': 'leaky_relu', 'use_bn_1': True, 'conv_dropout_1': 0.1, 'pool_type_1': 'avg', 'global_pool': 'avg', 'dense_units_0': 96, 'dense_activation_0': 'relu', 'dense_dropout_0': 0.5}. Best is trial 31 with value: 0.84820224933687.
Best trial: 31. Best value: 0.848202:  68%|██████████████████████████▌            | 68/100 [35:18<24:33, 46.04s/it, 2118.73/3600 seconds]
🔍 Trial 68: Starting architecture search...
🔧 Applying data augmentation (factor: 3x)...
✅ Data augmentation completed: 1,758 → 5,274 samples
✅ Architecture valid: 9,316 params, 0.04MB
🚀 Training model...
Restoring model weights from the end of the best epoch: 49.
📊 Evaluating model...
⏱️  Measuring inference time...
📈 Results for Trial 68:
   Exact Match Accuracy: 0.923
   Average F1-Score: 0.982
   Parameters: 9,316
   Model Size: 0.04MB
   Inference Time: 28.46ms
   Combined Score: 0.828
[I 2025-10-16 14:22:05,095] Trial 68 finished with value: 0.8275218461538462 and parameters: {'num_conv_layers': 2, 'num_dense_layers': 1, 'conv_filters_0': 32, 'conv_kernel_0': 9, 'conv_activation_0': 'swish', 'use_bn_0': False, 'conv_dropout_0': 0.3, 'conv_filters_1': 32, 'conv_kernel_1': 5, 'conv_activation_1': 'relu', 'use_bn_1': False, 'conv_dropout_1': 0.2, 'pool_type_1': 'avg', 'global_pool': 'avg', 'dense_units_0': 96, 'dense_activation_0': 'leaky_relu', 'dense_dropout_0': 0.5}. Best is trial 31 with value: 0.84820224933687.
Best trial: 31. Best value: 0.848202:  69%|██████████████████████████▉            | 69/100 [35:46<20:56, 40.54s/it, 2146.43/3600 seconds]
🔍 Trial 69: Starting architecture search...
🔧 Applying data augmentation (factor: 3x)...
✅ Data augmentation completed: 1,758 → 5,274 samples
✅ Architecture valid: 9,188 params, 0.04MB
🚀 Training model...
Restoring model weights from the end of the best epoch: 50.
📊 Evaluating model...
⏱️  Measuring inference time...
📈 Results for Trial 69:
   Exact Match Accuracy: 0.963
   Average F1-Score: 0.993
   Parameters: 9,188
   Model Size: 0.04MB
   Inference Time: 27.94ms
   Combined Score: 0.856
[I 2025-10-16 14:22:39,412] Trial 69 finished with value: 0.8556293050397877 and parameters: {'num_conv_layers': 2, 'num_dense_layers': 1, 'conv_filters_0': 32, 'conv_kernel_0': 3, 'conv_activation_0': 'relu', 'use_bn_0': True, 'conv_dropout_0': 0.3, 'conv_filters_1': 32, 'conv_kernel_1': 5, 'conv_activation_1': 'relu', 'use_bn_1': True, 'conv_dropout_1': 0.1, 'pool_type_1': 'avg', 'global_pool': 'avg', 'dense_units_0': 96, 'dense_activation_0': 'relu', 'dense_dropout_0': 0.5}. Best is trial 69 with value: 0.8556293050397877.
Best trial: 69. Best value: 0.855629:  70%|███████████████████████████▎           | 70/100 [36:20<19:20, 38.67s/it, 2180.75/3600 seconds]
🔍 Trial 70: Starting architecture search...
🔧 Applying data augmentation (factor: 3x)...
✅ Data augmentation completed: 1,758 → 5,274 samples
❌ Too many parameters: 425,924 > 100,000
[I 2025-10-16 14:22:40,196] Trial 70 pruned.                                                                                             
Best trial: 69. Best value: 0.855629:  71%|███████████████████████████▋           | 71/100 [36:21<13:11, 27.30s/it, 2181.53/3600 seconds]
🔍 Trial 71: Starting architecture search...
🔧 Applying data augmentation (factor: 3x)...
✅ Data augmentation completed: 1,758 → 5,274 samples
✅ Architecture valid: 9,188 params, 0.04MB
🚀 Training model...
Restoring model weights from the end of the best epoch: 49.
📊 Evaluating model...
⏱️  Measuring inference time...
📈 Results for Trial 71:
   Exact Match Accuracy: 0.960
   Average F1-Score: 0.991
   Parameters: 9,188
   Model Size: 0.04MB
   Inference Time: 27.64ms
   Combined Score: 0.854
[I 2025-10-16 14:23:12,677] Trial 71 finished with value: 0.8537725411140583 and parameters: {'num_conv_layers': 2, 'num_dense_layers': 1, 'conv_filters_0': 32, 'conv_kernel_0': 3, 'conv_activation_0': 'relu', 'use_bn_0': True, 'conv_dropout_0': 0.3, 'conv_filters_1': 32, 'conv_kernel_1': 5, 'conv_activation_1': 'relu', 'use_bn_1': True, 'conv_dropout_1': 0.1, 'pool_type_1': 'avg', 'global_pool': 'avg', 'dense_units_0': 96, 'dense_activation_0': 'relu', 'dense_dropout_0': 0.5}. Best is trial 69 with value: 0.8556293050397877.
Best trial: 69. Best value: 0.855629:  72%|████████████████████████████           | 72/100 [36:54<13:28, 28.86s/it, 2214.02/3600 seconds]
🔍 Trial 72: Starting architecture search...
🔧 Applying data augmentation (factor: 3x)...
✅ Data augmentation completed: 1,758 → 5,274 samples
✅ Architecture valid: 9,188 params, 0.04MB
🚀 Training model...
Restoring model weights from the end of the best epoch: 49.
📊 Evaluating model...
⏱️  Measuring inference time...
📈 Results for Trial 72:
   Exact Match Accuracy: 0.960
   Average F1-Score: 0.989
   Parameters: 9,188
   Model Size: 0.04MB
   Inference Time: 28.11ms
   Combined Score: 0.854
[I 2025-10-16 14:23:42,494] Trial 72 finished with value: 0.8537725411140583 and parameters: {'num_conv_layers': 2, 'num_dense_layers': 1, 'conv_filters_0': 32, 'conv_kernel_0': 3, 'conv_activation_0': 'relu', 'use_bn_0': True, 'conv_dropout_0': 0.3, 'conv_filters_1': 32, 'conv_kernel_1': 5, 'conv_activation_1': 'relu', 'use_bn_1': True, 'conv_dropout_1': 0.1, 'pool_type_1': 'avg', 'global_pool': 'avg', 'dense_units_0': 96, 'dense_activation_0': 'relu', 'dense_dropout_0': 0.5}. Best is trial 69 with value: 0.8556293050397877.
Best trial: 69. Best value: 0.855629:  73%|████████████████████████████▍          | 73/100 [37:23<13:06, 29.15s/it, 2243.83/3600 seconds]
🔍 Trial 73: Starting architecture search...
🔧 Applying data augmentation (factor: 3x)...
✅ Data augmentation completed: 1,758 → 5,274 samples
✅ Architecture valid: 9,188 params, 0.04MB
🚀 Training model...
Restoring model weights from the end of the best epoch: 49.
📊 Evaluating model...
⏱️  Measuring inference time...
📈 Results for Trial 73:
   Exact Match Accuracy: 0.958
   Average F1-Score: 0.990
   Parameters: 9,188
   Model Size: 0.04MB
   Inference Time: 31.42ms
   Combined Score: 0.852
[I 2025-10-16 14:24:13,934] Trial 73 finished with value: 0.8519157771883289 and parameters: {'num_conv_layers': 2, 'num_dense_layers': 1, 'conv_filters_0': 32, 'conv_kernel_0': 3, 'conv_activation_0': 'relu', 'use_bn_0': True, 'conv_dropout_0': 0.3, 'conv_filters_1': 32, 'conv_kernel_1': 5, 'conv_activation_1': 'relu', 'use_bn_1': True, 'conv_dropout_1': 0.1, 'pool_type_1': 'avg', 'global_pool': 'avg', 'dense_units_0': 96, 'dense_activation_0': 'relu', 'dense_dropout_0': 0.5}. Best is trial 69 with value: 0.8556293050397877.
Best trial: 69. Best value: 0.855629:  74%|████████████████████████████▊          | 74/100 [37:55<12:55, 29.83s/it, 2275.27/3600 seconds]
🔍 Trial 74: Starting architecture search...
🔧 Applying data augmentation (factor: 3x)...
✅ Data augmentation completed: 1,758 → 5,274 samples
✅ Architecture valid: 9,188 params, 0.04MB
🚀 Training model...
Restoring model weights from the end of the best epoch: 45.
📊 Evaluating model...
⏱️  Measuring inference time...
📈 Results for Trial 74:
   Exact Match Accuracy: 0.958
   Average F1-Score: 0.990
   Parameters: 9,188
   Model Size: 0.04MB
   Inference Time: 30.14ms
   Combined Score: 0.852
[I 2025-10-16 14:24:44,966] Trial 74 finished with value: 0.8519157771883289 and parameters: {'num_conv_layers': 2, 'num_dense_layers': 1, 'conv_filters_0': 32, 'conv_kernel_0': 3, 'conv_activation_0': 'relu', 'use_bn_0': True, 'conv_dropout_0': 0.3, 'conv_filters_1': 32, 'conv_kernel_1': 5, 'conv_activation_1': 'relu', 'use_bn_1': True, 'conv_dropout_1': 0.1, 'pool_type_1': 'avg', 'global_pool': 'avg', 'dense_units_0': 96, 'dense_activation_0': 'relu', 'dense_dropout_0': 0.5}. Best is trial 69 with value: 0.8556293050397877.
Best trial: 69. Best value: 0.855629:  75%|█████████████████████████████▎         | 75/100 [38:26<12:34, 30.19s/it, 2306.30/3600 seconds]
🔍 Trial 75: Starting architecture search...
🔧 Applying data augmentation (factor: 3x)...
✅ Data augmentation completed: 1,758 → 5,274 samples
✅ Architecture valid: 32,036 params, 0.12MB
🚀 Training model...
Restoring model weights from the end of the best epoch: 49.
📊 Evaluating model...
⏱️  Measuring inference time...
📈 Results for Trial 75:
   Exact Match Accuracy: 0.973
   Average F1-Score: 0.995
   Parameters: 32,036
   Model Size: 0.12MB
   Inference Time: 31.51ms
   Combined Score: 0.817
[I 2025-10-16 14:25:33,773] Trial 75 finished with value: 0.8173603607427056 and parameters: {'num_conv_layers': 2, 'num_dense_layers': 1, 'conv_filters_0': 32, 'conv_kernel_0': 3, 'conv_activation_0': 'relu', 'use_bn_0': True, 'conv_dropout_0': 0.4, 'conv_filters_1': 96, 'conv_kernel_1': 7, 'conv_activation_1': 'relu', 'use_bn_1': True, 'conv_dropout_1': 0.1, 'pool_type_1': 'avg', 'global_pool': 'avg', 'dense_units_0': 96, 'dense_activation_0': 'relu', 'dense_dropout_0': 0.5}. Best is trial 69 with value: 0.8556293050397877.
Best trial: 69. Best value: 0.855629:  76%|█████████████████████████████▋         | 76/100 [39:15<14:18, 35.78s/it, 2355.11/3600 seconds]
🔍 Trial 76: Starting architecture search...
🔧 Applying data augmentation (factor: 3x)...
✅ Data augmentation completed: 1,758 → 5,274 samples
✅ Architecture valid: 26,260 params, 0.10MB
🚀 Training model...

Epoch 39: ReduceLROnPlateau reducing learning rate to 0.0005000000237487257.
Restoring model weights from the end of the best epoch: 48.
📊 Evaluating model...
⏱️  Measuring inference time...
📈 Results for Trial 76:
   Exact Match Accuracy: 0.952
   Average F1-Score: 0.987
   Parameters: 26,260
   Model Size: 0.10MB
   Inference Time: 27.07ms
   Combined Score: 0.814
[I 2025-10-16 14:26:04,554] Trial 76 finished with value: 0.8140582493368701 and parameters: {'num_conv_layers': 2, 'num_dense_layers': 3, 'conv_filters_0': 32, 'conv_kernel_0': 3, 'conv_activation_0': 'relu', 'use_bn_0': True, 'conv_dropout_0': 0.3, 'conv_filters_1': 32, 'conv_kernel_1': 5, 'conv_activation_1': 'relu', 'use_bn_1': True, 'conv_dropout_1': 0.1, 'pool_type_1': 'avg', 'global_pool': 'avg', 'dense_units_0': 48, 'dense_activation_0': 'relu', 'dense_dropout_0': 0.5, 'dense_units_1': 128, 'dense_activation_1': 'relu', 'dense_dropout_1': 0.3, 'dense_units_2': 96, 'dense_activation_2': 'swish', 'dense_dropout_2': 0.5}. Best is trial 69 with value: 0.8556293050397877.
Best trial: 69. Best value: 0.855629:  77%|██████████████████████████████         | 77/100 [39:45<13:08, 34.28s/it, 2385.89/3600 seconds]
🔍 Trial 77: Starting architecture search...
🔧 Applying data augmentation (factor: 3x)...
✅ Data augmentation completed: 1,758 → 5,274 samples
✅ Architecture valid: 12,292 params, 0.05MB
🚀 Training model...
Restoring model weights from the end of the best epoch: 50.
📊 Evaluating model...
⏱️  Measuring inference time...
📈 Results for Trial 77:
   Exact Match Accuracy: 0.960
   Average F1-Score: 0.990
   Parameters: 12,292
   Model Size: 0.05MB
   Inference Time: 38.55ms
   Combined Score: 0.848
[I 2025-10-16 14:26:45,816] Trial 77 finished with value: 0.8475645411140583 and parameters: {'num_conv_layers': 2, 'num_dense_layers': 1, 'conv_filters_0': 64, 'conv_kernel_0': 3, 'conv_activation_0': 'relu', 'use_bn_0': True, 'conv_dropout_0': 0.3, 'conv_filters_1': 32, 'conv_kernel_1': 5, 'conv_activation_1': 'swish', 'use_bn_1': True, 'conv_dropout_1': 0.2, 'pool_type_1': 'avg', 'global_pool': 'avg', 'dense_units_0': 32, 'dense_activation_0': 'relu', 'dense_dropout_0': 0.4}. Best is trial 69 with value: 0.8556293050397877.
Best trial: 69. Best value: 0.855629:  78%|██████████████████████████████▍        | 78/100 [40:27<13:20, 36.37s/it, 2427.15/3600 seconds]
🔍 Trial 78: Starting architecture search...
🔧 Applying data augmentation (factor: 3x)...
✅ Data augmentation completed: 1,758 → 5,274 samples
❌ Too many parameters: 234,820 > 100,000
[I 2025-10-16 14:26:46,559] Trial 78 pruned.                                                                                             
Best trial: 69. Best value: 0.855629:  79%|██████████████████████████████▊        | 79/100 [40:27<08:59, 25.68s/it, 2427.90/3600 seconds]
🔍 Trial 79: Starting architecture search...
🔧 Applying data augmentation (factor: 3x)...
✅ Data augmentation completed: 1,758 → 5,274 samples
✅ Architecture valid: 40,900 params, 0.16MB
🚀 Training model...
❌ Trial 79 failed: Arguments `target` and `output` must have the same rank (ndim). Received: target.shape=(None, 4), output.shape=(None, 64, 4)
[I 2025-10-16 14:26:47,357] Trial 79 finished with value: 0.0 and parameters: {'num_conv_layers': 2, 'num_dense_layers': 1, 'conv_filters_0': 144, 'conv_kernel_0': 3, 'conv_activation_0': 'relu', 'use_bn_0': False, 'conv_dropout_0': 0.3, 'conv_filters_1': 48, 'conv_kernel_1': 5, 'conv_activation_1': 'relu', 'use_bn_1': True, 'conv_dropout_1': 0.1, 'pool_type_1': 'avg', 'global_pool': 'adaptive', 'dense_units_0': 96, 'dense_activation_0': 'relu', 'dense_dropout_0': 0.5}. Best is trial 69 with value: 0.8556293050397877.
Best trial: 69. Best value: 0.855629:  80%|███████████████████████████████▏       | 80/100 [40:28<06:04, 18.22s/it, 2428.70/3600 seconds]
🔍 Trial 80: Starting architecture search...
🔧 Applying data augmentation (factor: 3x)...
✅ Data augmentation completed: 1,758 → 5,274 samples
✅ Architecture valid: 75,652 params, 0.29MB
🚀 Training model...

Epoch 43: ReduceLROnPlateau reducing learning rate to 0.0005000000237487257.
Restoring model weights from the end of the best epoch: 46.
📊 Evaluating model...
⏱️  Measuring inference time...
📈 Results for Trial 80:
   Exact Match Accuracy: 0.979
   Average F1-Score: 0.995
   Parameters: 75,652
   Model Size: 0.29MB
   Inference Time: 28.68ms
   Combined Score: 0.734
[I 2025-10-16 14:28:08,399] Trial 80 finished with value: 0.7338418885941643 and parameters: {'num_conv_layers': 2, 'num_dense_layers': 1, 'conv_filters_0': 32, 'conv_kernel_0': 5, 'conv_activation_0': 'relu', 'use_bn_0': True, 'conv_dropout_0': 0.2, 'conv_filters_1': 192, 'conv_kernel_1': 9, 'conv_activation_1': 'relu', 'use_bn_1': True, 'conv_dropout_1': 0.1, 'pool_type_1': 'adaptive_avg', 'global_pool': 'avg', 'dense_units_0': 96, 'dense_activation_0': 'relu', 'dense_dropout_0': 0.5}. Best is trial 69 with value: 0.8556293050397877.
Best trial: 69. Best value: 0.855629:  81%|███████████████████████████████▌       | 81/100 [41:49<11:44, 37.07s/it, 2509.74/3600 seconds]
🔍 Trial 81: Starting architecture search...
🔧 Applying data augmentation (factor: 3x)...
✅ Data augmentation completed: 1,758 → 5,274 samples
✅ Architecture valid: 12,292 params, 0.05MB
🚀 Training model...
Restoring model weights from the end of the best epoch: 49.
📊 Evaluating model...
⏱️  Measuring inference time...
📈 Results for Trial 81:
   Exact Match Accuracy: 0.950
   Average F1-Score: 0.987
   Parameters: 12,292
   Model Size: 0.05MB
   Inference Time: 28.78ms
   Combined Score: 0.840
