(venv) jaime07ag@MacBook-Pro-de-Jaime Spectrum_Sensing_NAS % python run_nas.py pipeline
🚀 Neural Architecture Search for Spectrum Sensing
Target: <100K parameters, >98% accuracy, <0.5ms latency
============================================================
🔄 Running complete NAS pipeline...
🚀 Running full NAS search (100 trials)...
/Users/jaime07ag/Library/Mobile Documents/com~apple~CloudDocs/Downloads/Elva/Spectrum_Sensing_NAS/venv/lib/python3.9/site-packages/urllib3/__init__.py:35: NotOpenSSLWarning: urllib3 v2 only supports OpenSSL 1.1.1+, currently the 'ssl' module is compiled with 'LibreSSL 2.8.3'. See: https://github.com/urllib3/urllib3/issues/3020
  warnings.warn(
🚀 Starting Neural Architecture Search for Spectrum Sensing
======================================================================
🎯 Target Parameters: < 100,000
🎯 Target Accuracy: > 98.0%
🎯 Target Latency: < 0.5ms
🔍 Search Trials: 100
⚡ Optimization Weights: {'accuracy_weight': 0.7, 'efficiency_weight': 0.2, 'latency_weight': 0.1}
======================================================================
[I 2025-10-16 13:46:18,653] A new study created in memory with name: no-name-3d20f5a6-6dce-407c-9975-be9f09b70da0
  0%|                                                                                                            | 0/100 [00:00<?, ?it/s]
🔍 Trial 0: Starting architecture search...
🔄 Loading datasets...
📊 Loaded 1,758 samples from sdr_wifi_train.h5
📊 Loaded 377 samples from sdr_wifi_val.h5
📊 Loaded 377 samples from sdr_wifi_test.h5
✅ All datasets loaded successfully!
🔧 Applying data augmentation (factor: 3x)...
✅ Data augmentation completed: 1,758 → 5,274 samples
❌ Too many parameters: 256,804 > 100,000
[I 2025-10-16 13:46:19,475] Trial 0 pruned.                                                                                              
  1%|▊                                                                                | 1/100 [00:00<01:20,  1.23it/s, 0.81/3600 seconds]
🔍 Trial 1: Starting architecture search...
🔧 Applying data augmentation (factor: 3x)...
✅ Data augmentation completed: 1,758 → 5,274 samples
❌ Too many parameters: 220,852 > 100,000
[I 2025-10-16 13:46:20,232] Trial 1 pruned.                                                                                              
  2%|█▌                                                                               | 2/100 [00:01<01:16,  1.28it/s, 1.57/3600 seconds]
🔍 Trial 2: Starting architecture search...
🔧 Applying data augmentation (factor: 3x)...
✅ Data augmentation completed: 1,758 → 5,274 samples
❌ Too many parameters: 101,444 > 100,000
[I 2025-10-16 13:46:20,976] Trial 2 pruned.                                                                                              
  3%|██▍                                                                              | 3/100 [00:02<01:14,  1.31it/s, 2.31/3600 seconds]
🔍 Trial 3: Starting architecture search...
🔧 Applying data augmentation (factor: 3x)...
✅ Data augmentation completed: 1,758 → 5,274 samples
❌ Too many parameters: 290,964 > 100,000
[I 2025-10-16 13:46:21,741] Trial 3 pruned.                                                                                              
  4%|███▏                                                                             | 4/100 [00:03<01:13,  1.31it/s, 3.08/3600 seconds]
🔍 Trial 4: Starting architecture search...
🔧 Applying data augmentation (factor: 3x)...
✅ Data augmentation completed: 1,758 → 5,274 samples
✅ Architecture valid: 54,388 params, 0.21MB
🚀 Training model...
Restoring model weights from the end of the best epoch: 50.
📊 Evaluating model...
⏱️  Measuring inference time...
📈 Results for Trial 4:
   Exact Match Accuracy: 0.971
   Average F1-Score: 0.993
   Parameters: 54,388
   Model Size: 0.21MB
   Inference Time: 29.82ms
   Combined Score: 0.771
[I 2025-10-16 13:47:50,772] Trial 4 finished with value: 0.7707995968169761 and parameters: {'num_conv_layers': 3, 'num_dense_layers': 3, 'conv_filters_0': 48, 'conv_kernel_0': 9, 'conv_activation_0': 'gelu', 'use_bn_0': True, 'conv_dropout_0': 0.3, 'conv_filters_1': 128, 'conv_kernel_1': 3, 'conv_activation_1': 'gelu', 'use_bn_1': True, 'conv_dropout_1': 0.5, 'pool_type_1': 'avg', 'conv_filters_2': 32, 'conv_kernel_2': 7, 'conv_activation_2': 'leaky_relu', 'use_bn_2': True, 'conv_dropout_2': 0.4, 'global_pool': 'max', 'dense_units_0': 64, 'dense_activation_0': 'swish', 'dense_dropout_0': 0.3, 'dense_units_1': 32, 'dense_activation_1': 'leaky_relu', 'dense_dropout_1': 0.5, 'dense_units_2': 32, 'dense_activation_2': 'leaky_relu', 'dense_dropout_2': 0.3}. Best is trial 4 with value: 0.7707995968169761.
Best trial: 4. Best value: 0.7708:   5%|██▎                                          | 5/100 [01:32<51:36, 32.59s/it, 92.11/3600 seconds]
🔍 Trial 5: Starting architecture search...
🔧 Applying data augmentation (factor: 3x)...
✅ Data augmentation completed: 1,758 → 5,274 samples
❌ Too many parameters: 245,364 > 100,000
[I 2025-10-16 13:47:51,561] Trial 5 pruned.                                                                                              
Best trial: 4. Best value: 0.7708:   6%|██▋                                          | 6/100 [01:32<34:07, 21.78s/it, 92.90/3600 seconds]
🔍 Trial 6: Starting architecture search...
🔧 Applying data augmentation (factor: 3x)...
✅ Data augmentation completed: 1,758 → 5,274 samples
❌ Too many parameters: 297,156 > 100,000
[I 2025-10-16 13:47:52,306] Trial 6 pruned.                                                                                              
Best trial: 4. Best value: 0.7708:   7%|███▏                                         | 7/100 [01:33<23:06, 14.90s/it, 93.64/3600 seconds]
🔍 Trial 7: Starting architecture search...
🔧 Applying data augmentation (factor: 3x)...
✅ Data augmentation completed: 1,758 → 5,274 samples
❌ Too many parameters: 156,692 > 100,000
[I 2025-10-16 13:47:53,059] Trial 7 pruned.                                                                                              
Best trial: 4. Best value: 0.7708:   8%|███▌                                         | 8/100 [01:34<15:56, 10.40s/it, 94.40/3600 seconds]
🔍 Trial 8: Starting architecture search...
🔧 Applying data augmentation (factor: 3x)...
✅ Data augmentation completed: 1,758 → 5,274 samples
✅ Architecture valid: 93,412 params, 0.36MB
🚀 Training model...
❌ Trial 8 failed: Arguments `target` and `output` must have the same rank (ndim). Received: target.shape=(None, 4), output.shape=(None, 128, 4)
[I 2025-10-16 13:47:54,139] Trial 8 finished with value: 0.0 and parameters: {'num_conv_layers': 3, 'num_dense_layers': 3, 'conv_filters_0': 128, 'conv_kernel_0': 5, 'conv_activation_0': 'gelu', 'use_bn_0': True, 'conv_dropout_0': 0.2, 'conv_filters_1': 64, 'conv_kernel_1': 3, 'conv_activation_1': 'gelu', 'use_bn_1': False, 'conv_dropout_1': 0.3, 'pool_type_1': 'adaptive_avg', 'conv_filters_2': 128, 'conv_kernel_2': 5, 'conv_activation_2': 'relu', 'use_bn_2': True, 'conv_dropout_2': 0.4, 'global_pool': 'adaptive', 'dense_units_0': 128, 'dense_activation_0': 'leaky_relu', 'dense_dropout_0': 0.3, 'dense_units_1': 48, 'dense_activation_1': 'leaky_relu', 'dense_dropout_1': 0.4, 'dense_units_2': 48, 'dense_activation_2': 'leaky_relu', 'dense_dropout_2': 0.5}. Best is trial 4 with value: 0.7707995968169761.
Best trial: 4. Best value: 0.7708:   9%|████                                         | 9/100 [01:35<11:21,  7.49s/it, 95.48/3600 seconds]
🔍 Trial 9: Starting architecture search...
🔧 Applying data augmentation (factor: 3x)...
✅ Data augmentation completed: 1,758 → 5,274 samples
✅ Architecture valid: 82,500 params, 0.31MB
🚀 Training model...
❌ Trial 9 failed: Arguments `target` and `output` must have the same rank (ndim). Received: target.shape=(None, 4), output.shape=(None, 64, 4)
[I 2025-10-16 13:47:54,979] Trial 9 finished with value: 0.0 and parameters: {'num_conv_layers': 3, 'num_dense_layers': 2, 'conv_filters_0': 48, 'conv_kernel_0': 9, 'conv_activation_0': 'leaky_relu', 'use_bn_0': False, 'conv_dropout_0': 0.1, 'conv_filters_1': 64, 'conv_kernel_1': 3, 'conv_activation_1': 'leaky_relu', 'use_bn_1': False, 'conv_dropout_1': 0.5, 'pool_type_1': 'avg', 'conv_filters_2': 160, 'conv_kernel_2': 5, 'conv_activation_2': 'relu', 'use_bn_2': True, 'conv_dropout_2': 0.1, 'global_pool': 'adaptive', 'dense_units_0': 96, 'dense_activation_0': 'relu', 'dense_dropout_0': 0.4, 'dense_units_1': 48, 'dense_activation_1': 'swish', 'dense_dropout_1': 0.5}. Best is trial 4 with value: 0.7707995968169761.
Best trial: 4. Best value: 0.7708:  10%|████▍                                       | 10/100 [01:36<08:09,  5.43s/it, 96.32/3600 seconds]
🔍 Trial 10: Starting architecture search...
🔧 Applying data augmentation (factor: 3x)...
✅ Data augmentation completed: 1,758 → 5,274 samples
❌ Too many parameters: 349,300 > 100,000
[I 2025-10-16 13:47:55,775] Trial 10 pruned.                                                                                             
Best trial: 4. Best value: 0.7708:  11%|████▊                                       | 11/100 [01:37<05:57,  4.01s/it, 97.11/3600 seconds]
🔍 Trial 11: Starting architecture search...
🔧 Applying data augmentation (factor: 3x)...
✅ Data augmentation completed: 1,758 → 5,274 samples
❌ Too many parameters: 132,116 > 100,000
[I 2025-10-16 13:47:56,525] Trial 11 pruned.                                                                                             
Best trial: 4. Best value: 0.7708:  12%|█████▎                                      | 12/100 [01:37<04:25,  3.02s/it, 97.86/3600 seconds]
🔍 Trial 12: Starting architecture search...
🔧 Applying data augmentation (factor: 3x)...
✅ Data augmentation completed: 1,758 → 5,274 samples
✅ Architecture valid: 26,884 params, 0.10MB
🚀 Training model...
❌ Trial 12 failed: Arguments `target` and `output` must have the same rank (ndim). Received: target.shape=(None, 4), output.shape=(None, 128, 4)
[I 2025-10-16 13:47:57,361] Trial 12 finished with value: 0.0 and parameters: {'num_conv_layers': 2, 'num_dense_layers': 3, 'conv_filters_0': 96, 'conv_kernel_0': 5, 'conv_activation_0': 'gelu', 'use_bn_0': True, 'conv_dropout_0': 0.3, 'conv_filters_1': 64, 'conv_kernel_1': 3, 'conv_activation_1': 'gelu', 'use_bn_1': True, 'conv_dropout_1': 0.5, 'pool_type_1': 'adaptive_avg', 'global_pool': 'adaptive', 'dense_units_0': 32, 'dense_activation_0': 'leaky_relu', 'dense_dropout_0': 0.3, 'dense_units_1': 32, 'dense_activation_1': 'leaky_relu', 'dense_dropout_1': 0.4, 'dense_units_2': 96, 'dense_activation_2': 'leaky_relu', 'dense_dropout_2': 0.5}. Best is trial 4 with value: 0.7707995968169761.
Best trial: 4. Best value: 0.7708:  13%|█████▋                                      | 13/100 [01:38<03:25,  2.36s/it, 98.70/3600 seconds]
🔍 Trial 13: Starting architecture search...
🔧 Applying data augmentation (factor: 3x)...
✅ Data augmentation completed: 1,758 → 5,274 samples
✅ Architecture valid: 88,164 params, 0.34MB
🚀 Training model...
❌ Trial 13 failed: Arguments `target` and `output` must have the same rank (ndim). Received: target.shape=(None, 4), output.shape=(None, 128, 4)
[I 2025-10-16 13:47:58,250] Trial 13 finished with value: 0.0 and parameters: {'num_conv_layers': 3, 'num_dense_layers': 3, 'conv_filters_0': 48, 'conv_kernel_0': 5, 'conv_activation_0': 'gelu', 'use_bn_0': True, 'conv_dropout_0': 0.5, 'conv_filters_1': 48, 'conv_kernel_1': 3, 'conv_activation_1': 'gelu', 'use_bn_1': False, 'conv_dropout_1': 0.4, 'pool_type_1': 'adaptive_avg', 'conv_filters_2': 192, 'conv_kernel_2': 7, 'conv_activation_2': 'gelu', 'use_bn_2': True, 'conv_dropout_2': 0.4, 'global_pool': 'adaptive', 'dense_units_0': 48, 'dense_activation_0': 'leaky_relu', 'dense_dropout_0': 0.3, 'dense_units_1': 48, 'dense_activation_1': 'leaky_relu', 'dense_dropout_1': 0.5, 'dense_units_2': 64, 'dense_activation_2': 'leaky_relu', 'dense_dropout_2': 0.3}. Best is trial 4 with value: 0.7707995968169761.
Best trial: 4. Best value: 0.7708:  14%|██████▏                                     | 14/100 [01:39<02:44,  1.92s/it, 99.59/3600 seconds]
🔍 Trial 14: Starting architecture search...
🔧 Applying data augmentation (factor: 3x)...
✅ Data augmentation completed: 1,758 → 5,274 samples
✅ Architecture valid: 36,820 params, 0.14MB
🚀 Training model...

Epoch 44: ReduceLROnPlateau reducing learning rate to 0.0005000000237487257.
Restoring model weights from the end of the best epoch: 50.
📊 Evaluating model...
⏱️  Measuring inference time...
📈 Results for Trial 14:
   Exact Match Accuracy: 0.955
   Average F1-Score: 0.990
   Parameters: 36,820
   Model Size: 0.14MB
   Inference Time: 29.50ms
   Combined Score: 0.795
[I 2025-10-16 13:48:56,035] Trial 14 finished with value: 0.7947950132625994 and parameters: {'num_conv_layers': 3, 'num_dense_layers': 3, 'conv_filters_0': 32, 'conv_kernel_0': 3, 'conv_activation_0': 'swish', 'use_bn_0': True, 'conv_dropout_0': 0.3, 'conv_filters_1': 32, 'conv_kernel_1': 3, 'conv_activation_1': 'relu', 'use_bn_1': True, 'conv_dropout_1': 0.1, 'pool_type_1': 'avg', 'conv_filters_2': 128, 'conv_kernel_2': 5, 'conv_activation_2': 'relu', 'use_bn_2': True, 'conv_dropout_2': 0.4, 'global_pool': 'max', 'dense_units_0': 64, 'dense_activation_0': 'relu', 'dense_dropout_0': 0.3, 'dense_units_1': 32, 'dense_activation_1': 'leaky_relu', 'dense_dropout_1': 0.4, 'dense_units_2': 48, 'dense_activation_2': 'swish', 'dense_dropout_2': 0.4}. Best is trial 14 with value: 0.7947950132625994.
Best trial: 14. Best value: 0.794795:  15%|██████                                  | 15/100 [02:37<26:34, 18.76s/it, 157.37/3600 seconds]
🔍 Trial 15: Starting architecture search...
🔧 Applying data augmentation (factor: 3x)...
✅ Data augmentation completed: 1,758 → 5,274 samples
✅ Architecture valid: 11,140 params, 0.04MB
🚀 Training model...
Restoring model weights from the end of the best epoch: 48.
📊 Evaluating model...
⏱️  Measuring inference time...
📈 Results for Trial 15:
   Exact Match Accuracy: 0.944
   Average F1-Score: 0.983
   Parameters: 11,140
   Model Size: 0.04MB
   Inference Time: 28.48ms
   Combined Score: 0.839
[I 2025-10-16 13:49:39,141] Trial 15 finished with value: 0.8387279575596817 and parameters: {'num_conv_layers': 3, 'num_dense_layers': 2, 'conv_filters_0': 32, 'conv_kernel_0': 3, 'conv_activation_0': 'swish', 'use_bn_0': True, 'conv_dropout_0': 0.3, 'conv_filters_1': 32, 'conv_kernel_1': 3, 'conv_activation_1': 'relu', 'use_bn_1': True, 'conv_dropout_1': 0.1, 'pool_type_1': 'avg', 'conv_filters_2': 32, 'conv_kernel_2': 3, 'conv_activation_2': 'leaky_relu', 'use_bn_2': True, 'conv_dropout_2': 0.2, 'global_pool': 'max', 'dense_units_0': 64, 'dense_activation_0': 'relu', 'dense_dropout_0': 0.3, 'dense_units_1': 32, 'dense_activation_1': 'leaky_relu', 'dense_dropout_1': 0.4}. Best is trial 15 with value: 0.8387279575596817.
Best trial: 15. Best value: 0.838728:  16%|██████▍                                 | 16/100 [03:20<36:31, 26.09s/it, 200.48/3600 seconds]
🔍 Trial 16: Starting architecture search...
🔧 Applying data augmentation (factor: 3x)...
✅ Data augmentation completed: 1,758 → 5,274 samples
✅ Architecture valid: 42,580 params, 0.16MB
🚀 Training model...
Restoring model weights from the end of the best epoch: 50.
📊 Evaluating model...
⏱️  Measuring inference time...
📈 Results for Trial 16:
   Exact Match Accuracy: 0.968
   Average F1-Score: 0.993
   Parameters: 42,580
   Model Size: 0.16MB
   Inference Time: 29.47ms
   Combined Score: 0.793
[I 2025-10-16 13:50:44,444] Trial 16 finished with value: 0.7925588328912467 and parameters: {'num_conv_layers': 4, 'num_dense_layers': 2, 'conv_filters_0': 32, 'conv_kernel_0': 3, 'conv_activation_0': 'swish', 'use_bn_0': True, 'conv_dropout_0': 0.3, 'conv_filters_1': 32, 'conv_kernel_1': 9, 'conv_activation_1': 'relu', 'use_bn_1': True, 'conv_dropout_1': 0.1, 'pool_type_1': 'avg', 'conv_filters_2': 48, 'conv_kernel_2': 3, 'conv_activation_2': 'relu', 'use_bn_2': False, 'conv_dropout_2': 0.2, 'conv_filters_3': 64, 'conv_kernel_3': 7, 'conv_activation_3': 'gelu', 'use_bn_3': True, 'conv_dropout_3': 0.5, 'pool_type_3': 'adaptive_avg', 'global_pool': 'max', 'dense_units_0': 64, 'dense_activation_0': 'relu', 'dense_dropout_0': 0.3, 'dense_units_1': 32, 'dense_activation_1': 'leaky_relu', 'dense_dropout_1': 0.4}. Best is trial 15 with value: 0.8387279575596817.
Best trial: 15. Best value: 0.838728:  17%|██████▊                                 | 17/100 [04:25<52:23, 37.88s/it, 265.78/3600 seconds]
🔍 Trial 17: Starting architecture search...
🔧 Applying data augmentation (factor: 3x)...
✅ Data augmentation completed: 1,758 → 5,274 samples
✅ Architecture valid: 9,956 params, 0.04MB
🚀 Training model...

Epoch 46: ReduceLROnPlateau reducing learning rate to 0.0005000000237487257.
Restoring model weights from the end of the best epoch: 47.
📊 Evaluating model...
⏱️  Measuring inference time...
📈 Results for Trial 17:
   Exact Match Accuracy: 0.936
   Average F1-Score: 0.983
   Parameters: 9,956
   Model Size: 0.04MB
   Inference Time: 33.29ms
   Combined Score: 0.836
[I 2025-10-16 13:51:22,583] Trial 17 finished with value: 0.8355256657824933 and parameters: {'num_conv_layers': 2, 'num_dense_layers': 2, 'conv_filters_0': 32, 'conv_kernel_0': 3, 'conv_activation_0': 'swish', 'use_bn_0': True, 'conv_dropout_0': 0.3, 'conv_filters_1': 32, 'conv_kernel_1': 5, 'conv_activation_1': 'relu', 'use_bn_1': True, 'conv_dropout_1': 0.1, 'pool_type_1': 'avg', 'global_pool': 'max', 'dense_units_0': 64, 'dense_activation_0': 'relu', 'dense_dropout_0': 0.3, 'dense_units_1': 32, 'dense_activation_1': 'swish', 'dense_dropout_1': 0.4}. Best is trial 15 with value: 0.8387279575596817.
Best trial: 15. Best value: 0.838728:  18%|███████▏                                | 18/100 [05:03<51:52, 37.96s/it, 303.92/3600 seconds]
🔍 Trial 18: Starting architecture search...
🔧 Applying data augmentation (factor: 3x)...
✅ Data augmentation completed: 1,758 → 5,274 samples
✅ Architecture valid: 12,164 params, 0.05MB
🚀 Training model...
Restoring model weights from the end of the best epoch: 45.
📊 Evaluating model...
⏱️  Measuring inference time...
📈 Results for Trial 18:
   Exact Match Accuracy: 0.902
   Average F1-Score: 0.967
   Parameters: 12,164
   Model Size: 0.05MB
   Inference Time: 32.57ms
   Combined Score: 0.807
[I 2025-10-16 13:52:03,709] Trial 18 finished with value: 0.8069717347480106 and parameters: {'num_conv_layers': 2, 'num_dense_layers': 2, 'conv_filters_0': 32, 'conv_kernel_0': 3, 'conv_activation_0': 'swish', 'use_bn_0': True, 'conv_dropout_0': 0.3, 'conv_filters_1': 32, 'conv_kernel_1': 5, 'conv_activation_1': 'relu', 'use_bn_1': True, 'conv_dropout_1': 0.1, 'pool_type_1': 'avg', 'global_pool': 'max', 'dense_units_0': 64, 'dense_activation_0': 'relu', 'dense_dropout_0': 0.5, 'dense_units_1': 64, 'dense_activation_1': 'swish', 'dense_dropout_1': 0.4}. Best is trial 15 with value: 0.8387279575596817.
Best trial: 15. Best value: 0.838728:  19%|███████▌                                | 19/100 [05:45<52:31, 38.91s/it, 345.05/3600 seconds]
🔍 Trial 19: Starting architecture search...
🔧 Applying data augmentation (factor: 3x)...
✅ Data augmentation completed: 1,758 → 5,274 samples
✅ Architecture valid: 14,372 params, 0.05MB
🚀 Training model...

Epoch 46: ReduceLROnPlateau reducing learning rate to 0.0005000000237487257.
Restoring model weights from the end of the best epoch: 39.
📊 Evaluating model...
⏱️  Measuring inference time...
📈 Results for Trial 19:
   Exact Match Accuracy: 0.918
   Average F1-Score: 0.972
   Parameters: 14,372
   Model Size: 0.05MB
   Inference Time: 31.20ms
   Combined Score: 0.814
[I 2025-10-16 13:52:45,932] Trial 19 finished with value: 0.8136963183023873 and parameters: {'num_conv_layers': 2, 'num_dense_layers': 2, 'conv_filters_0': 32, 'conv_kernel_0': 3, 'conv_activation_0': 'swish', 'use_bn_0': True, 'conv_dropout_0': 0.3, 'conv_filters_1': 32, 'conv_kernel_1': 5, 'conv_activation_1': 'relu', 'use_bn_1': True, 'conv_dropout_1': 0.1, 'pool_type_1': 'avg', 'global_pool': 'max', 'dense_units_0': 64, 'dense_activation_0': 'relu', 'dense_dropout_0': 0.4, 'dense_units_1': 96, 'dense_activation_1': 'swish', 'dense_dropout_1': 0.4}. Best is trial 15 with value: 0.8387279575596817.
Best trial: 15. Best value: 0.838728:  20%|████████                                | 20/100 [06:27<53:12, 39.90s/it, 387.27/3600 seconds]
🔍 Trial 20: Starting architecture search...
🔧 Applying data augmentation (factor: 3x)...
✅ Data augmentation completed: 1,758 → 5,274 samples
✅ Architecture valid: 30,804 params, 0.12MB
🚀 Training model...

Epoch 40: ReduceLROnPlateau reducing learning rate to 0.0005000000237487257.

Epoch 47: ReduceLROnPlateau reducing learning rate to 0.0002500000118743628.
Epoch 48: early stopping
Restoring model weights from the end of the best epoch: 33.
📊 Evaluating model...
⏱️  Measuring inference time...
📈 Results for Trial 20:
   Exact Match Accuracy: 0.905
   Average F1-Score: 0.977
   Parameters: 30,804
   Model Size: 0.12MB
   Inference Time: 29.84ms
   Combined Score: 0.772
