[I 2025-10-16 14:05:21,840] Trial 42 finished with value: 0.8352049018567639 and parameters: {'num_conv_layers': 2, 'num_dense_layers': 1, 'conv_filters_0': 32, 'conv_kernel_0': 3, 'conv_activation_0': 'swish', 'use_bn_0': True, 'conv_dropout_0': 0.3, 'conv_filters_1': 32, 'conv_kernel_1': 5, 'conv_activation_1': 'relu', 'use_bn_1': True, 'conv_dropout_1': 0.1, 'pool_type_1': 'avg', 'global_pool': 'avg', 'dense_units_0': 96, 'dense_activation_0': 'relu', 'dense_dropout_0': 0.5}. Best is trial 31 with value: 0.84820224933687.
Best trial: 31. Best value: 0.848202:  43%|████████████████▊                      | 43/100 [19:03<21:17, 22.41s/it, 1143.18/3600 seconds]
🔍 Trial 43: Starting architecture search...
🔧 Applying data augmentation (factor: 3x)...
✅ Data augmentation completed: 1,758 → 5,274 samples
✅ Architecture valid: 10,756 params, 0.04MB
🚀 Training model...
Restoring model weights from the end of the best epoch: 50.
📊 Evaluating model...
⏱️  Measuring inference time...
📈 Results for Trial 43:
   Exact Match Accuracy: 0.939
   Average F1-Score: 0.984
   Parameters: 10,756
   Model Size: 0.04MB
   Inference Time: 27.19ms
   Combined Score: 0.836
[I 2025-10-16 14:05:53,886] Trial 43 finished with value: 0.8357824297082228 and parameters: {'num_conv_layers': 2, 'num_dense_layers': 1, 'conv_filters_0': 32, 'conv_kernel_0': 9, 'conv_activation_0': 'swish', 'use_bn_0': True, 'conv_dropout_0': 0.3, 'conv_filters_1': 32, 'conv_kernel_1': 5, 'conv_activation_1': 'relu', 'use_bn_1': True, 'conv_dropout_1': 0.5, 'pool_type_1': 'avg', 'global_pool': 'avg', 'dense_units_0': 128, 'dense_activation_0': 'relu', 'dense_dropout_0': 0.5}. Best is trial 31 with value: 0.84820224933687.
Best trial: 31. Best value: 0.848202:  44%|█████████████████▏                     | 44/100 [19:35<23:36, 25.30s/it, 1175.22/3600 seconds]
🔍 Trial 44: Starting architecture search...
🔧 Applying data augmentation (factor: 3x)...
✅ Data augmentation completed: 1,758 → 5,274 samples
✅ Architecture valid: 7,012 params, 0.03MB
🚀 Training model...
Restoring model weights from the end of the best epoch: 44.
📊 Evaluating model...
⏱️  Measuring inference time...
📈 Results for Trial 44:
   Exact Match Accuracy: 0.926
   Average F1-Score: 0.977
   Parameters: 7,012
   Model Size: 0.03MB
   Inference Time: 28.53ms
   Combined Score: 0.834
[I 2025-10-16 14:06:20,161] Trial 44 finished with value: 0.8339866100795755 and parameters: {'num_conv_layers': 2, 'num_dense_layers': 1, 'conv_filters_0': 32, 'conv_kernel_0': 3, 'conv_activation_0': 'relu', 'use_bn_0': True, 'conv_dropout_0': 0.1, 'conv_filters_1': 32, 'conv_kernel_1': 3, 'conv_activation_1': 'leaky_relu', 'use_bn_1': False, 'conv_dropout_1': 0.4, 'pool_type_1': 'avg', 'global_pool': 'avg', 'dense_units_0': 96, 'dense_activation_0': 'leaky_relu', 'dense_dropout_0': 0.5}. Best is trial 31 with value: 0.84820224933687.
Best trial: 31. Best value: 0.848202:  45%|█████████████████▌                     | 45/100 [20:01<23:27, 25.59s/it, 1201.50/3600 seconds]
🔍 Trial 45: Starting architecture search...
🔧 Applying data augmentation (factor: 3x)...
✅ Data augmentation completed: 1,758 → 5,274 samples
❌ Too many parameters: 235,348 > 100,000
[I 2025-10-16 14:06:20,927] Trial 45 pruned.                                                                                             
Best trial: 31. Best value: 0.848202:  46%|█████████████████▉                     | 46/100 [20:02<16:19, 18.15s/it, 1202.27/3600 seconds]
🔍 Trial 46: Starting architecture search...
🔧 Applying data augmentation (factor: 3x)...
✅ Data augmentation completed: 1,758 → 5,274 samples
✅ Architecture valid: 13,444 params, 0.05MB
🚀 Training model...
Restoring model weights from the end of the best epoch: 50.
📊 Evaluating model...
⏱️  Measuring inference time...
📈 Results for Trial 46:
   Exact Match Accuracy: 0.942
   Average F1-Score: 0.987
   Parameters: 13,444
   Model Size: 0.05MB
   Inference Time: 30.01ms
   Combined Score: 0.832
[I 2025-10-16 14:06:57,044] Trial 46 finished with value: 0.8322631936339523 and parameters: {'num_conv_layers': 2, 'num_dense_layers': 1, 'conv_filters_0': 32, 'conv_kernel_0': 3, 'conv_activation_0': 'leaky_relu', 'use_bn_0': True, 'conv_dropout_0': 0.4, 'conv_filters_1': 64, 'conv_kernel_1': 3, 'conv_activation_1': 'relu', 'use_bn_1': True, 'conv_dropout_1': 0.1, 'pool_type_1': 'avg', 'global_pool': 'avg', 'dense_units_0': 96, 'dense_activation_0': 'relu', 'dense_dropout_0': 0.5}. Best is trial 31 with value: 0.84820224933687.
Best trial: 31. Best value: 0.848202:  47%|██████████████████▎                    | 47/100 [20:38<20:47, 23.54s/it, 1238.38/3600 seconds]
🔍 Trial 47: Starting architecture search...
🔧 Applying data augmentation (factor: 3x)...
✅ Data augmentation completed: 1,758 → 5,274 samples
✅ Architecture valid: 48,628 params, 0.19MB
🚀 Training model...

Epoch 33: ReduceLROnPlateau reducing learning rate to 0.0005000000237487257.
Restoring model weights from the end of the best epoch: 49.
📊 Evaluating model...
⏱️  Measuring inference time...
📈 Results for Trial 47:
   Exact Match Accuracy: 0.942
   Average F1-Score: 0.984
   Parameters: 48,628
   Model Size: 0.19MB
   Inference Time: 29.56ms
   Combined Score: 0.762
[I 2025-10-16 14:08:28,870] Trial 47 finished with value: 0.7618951936339522 and parameters: {'num_conv_layers': 3, 'num_dense_layers': 1, 'conv_filters_0': 192, 'conv_kernel_0': 3, 'conv_activation_0': 'swish', 'use_bn_0': True, 'conv_dropout_0': 0.2, 'conv_filters_1': 32, 'conv_kernel_1': 5, 'conv_activation_1': 'leaky_relu', 'use_bn_1': False, 'conv_dropout_1': 0.5, 'pool_type_1': 'avg', 'conv_filters_2': 48, 'conv_kernel_2': 9, 'conv_activation_2': 'leaky_relu', 'use_bn_2': True, 'conv_dropout_2': 0.2, 'global_pool': 'avg', 'dense_units_0': 32, 'dense_activation_0': 'leaky_relu', 'dense_dropout_0': 0.5}. Best is trial 31 with value: 0.84820224933687.
Best trial: 31. Best value: 0.848202:  48%|██████████████████▋                    | 48/100 [22:10<38:09, 44.02s/it, 1330.21/3600 seconds]
🔍 Trial 48: Starting architecture search...
🔧 Applying data augmentation (factor: 3x)...
✅ Data augmentation completed: 1,758 → 5,274 samples
❌ Too many parameters: 217,956 > 100,000
[I 2025-10-16 14:08:29,612] Trial 48 pruned.                                                                                             
Best trial: 31. Best value: 0.848202:  49%|███████████████████                    | 49/100 [22:10<26:22, 31.04s/it, 1330.95/3600 seconds]
🔍 Trial 49: Starting architecture search...
🔧 Applying data augmentation (factor: 3x)...
✅ Data augmentation completed: 1,758 → 5,274 samples
✅ Architecture valid: 15,028 params, 0.06MB
🚀 Training model...
Restoring model weights from the end of the best epoch: 47.
📊 Evaluating model...
⏱️  Measuring inference time...
📈 Results for Trial 49:
   Exact Match Accuracy: 0.950
   Average F1-Score: 0.984
   Parameters: 15,028
   Model Size: 0.06MB
   Inference Time: 28.44ms
   Combined Score: 0.835
[I 2025-10-16 14:09:17,099] Trial 49 finished with value: 0.8346654854111405 and parameters: {'num_conv_layers': 2, 'num_dense_layers': 1, 'conv_filters_0': 32, 'conv_kernel_0': 5, 'conv_activation_0': 'gelu', 'use_bn_0': True, 'conv_dropout_0': 0.5, 'conv_filters_1': 96, 'conv_kernel_1': 3, 'conv_activation_1': 'relu', 'use_bn_1': True, 'conv_dropout_1': 0.1, 'pool_type_1': 'adaptive_avg', 'global_pool': 'avg', 'dense_units_0': 48, 'dense_activation_0': 'relu', 'dense_dropout_0': 0.5}. Best is trial 31 with value: 0.84820224933687.
Best trial: 31. Best value: 0.848202:  50%|███████████████████▌                   | 50/100 [22:58<29:58, 35.97s/it, 1378.44/3600 seconds]
🔍 Trial 50: Starting architecture search...
🔧 Applying data augmentation (factor: 3x)...
✅ Data augmentation completed: 1,758 → 5,274 samples
✅ Architecture valid: 49,412 params, 0.19MB
🚀 Training model...

Epoch 28: ReduceLROnPlateau reducing learning rate to 0.0005000000237487257.

Epoch 38: ReduceLROnPlateau reducing learning rate to 0.0002500000118743628.
Restoring model weights from the end of the best epoch: 47.
📊 Evaluating model...
⏱️  Measuring inference time...
📈 Results for Trial 50:
   Exact Match Accuracy: 0.958
   Average F1-Score: 0.990
   Parameters: 49,412
   Model Size: 0.19MB
   Inference Time: 28.00ms
   Combined Score: 0.771
[I 2025-10-16 14:10:27,832] Trial 50 finished with value: 0.7714677771883289 and parameters: {'num_conv_layers': 3, 'num_dense_layers': 1, 'conv_filters_0': 64, 'conv_kernel_0': 3, 'conv_activation_0': 'relu', 'use_bn_0': True, 'conv_dropout_0': 0.3, 'conv_filters_1': 32, 'conv_kernel_1': 5, 'conv_activation_1': 'gelu', 'use_bn_1': True, 'conv_dropout_1': 0.4, 'pool_type_1': 'avg', 'conv_filters_2': 192, 'conv_kernel_2': 3, 'conv_activation_2': 'swish', 'use_bn_2': True, 'conv_dropout_2': 0.5, 'global_pool': 'avg', 'dense_units_0': 96, 'dense_activation_0': 'swish', 'dense_dropout_0': 0.5}. Best is trial 31 with value: 0.84820224933687.
Best trial: 31. Best value: 0.848202:  51%|███████████████████▉                   | 51/100 [24:09<37:53, 46.40s/it, 1449.17/3600 seconds]
🔍 Trial 51: Starting architecture search...
🔧 Applying data augmentation (factor: 3x)...
✅ Data augmentation completed: 1,758 → 5,274 samples
✅ Architecture valid: 9,188 params, 0.04MB
🚀 Training model...
Restoring model weights from the end of the best epoch: 44.
📊 Evaluating model...
⏱️  Measuring inference time...
📈 Results for Trial 51:
   Exact Match Accuracy: 0.931
   Average F1-Score: 0.981
   Parameters: 9,188
   Model Size: 0.04MB
   Inference Time: 33.67ms
   Combined Score: 0.833
[I 2025-10-16 14:11:00,026] Trial 51 finished with value: 0.8333481379310345 and parameters: {'num_conv_layers': 2, 'num_dense_layers': 1, 'conv_filters_0': 32, 'conv_kernel_0': 3, 'conv_activation_0': 'swish', 'use_bn_0': True, 'conv_dropout_0': 0.3, 'conv_filters_1': 32, 'conv_kernel_1': 5, 'conv_activation_1': 'relu', 'use_bn_1': True, 'conv_dropout_1': 0.1, 'pool_type_1': 'avg', 'global_pool': 'avg', 'dense_units_0': 96, 'dense_activation_0': 'relu', 'dense_dropout_0': 0.5}. Best is trial 31 with value: 0.84820224933687.
Best trial: 31. Best value: 0.848202:  52%|████████████████████▎                  | 52/100 [24:41<33:42, 42.14s/it, 1481.36/3600 seconds]
🔍 Trial 52: Starting architecture search...
🔧 Applying data augmentation (factor: 3x)...
✅ Data augmentation completed: 1,758 → 5,274 samples
✅ Architecture valid: 9,188 params, 0.04MB
🚀 Training model...

Epoch 13: ReduceLROnPlateau reducing learning rate to 0.0005000000237487257.
Restoring model weights from the end of the best epoch: 48.
📊 Evaluating model...
⏱️  Measuring inference time...
📈 Results for Trial 52:
   Exact Match Accuracy: 0.928
   Average F1-Score: 0.983
   Parameters: 9,188
   Model Size: 0.04MB
   Inference Time: 29.54ms
   Combined Score: 0.831
[I 2025-10-16 14:11:31,058] Trial 52 finished with value: 0.831491374005305 and parameters: {'num_conv_layers': 2, 'num_dense_layers': 1, 'conv_filters_0': 32, 'conv_kernel_0': 3, 'conv_activation_0': 'swish', 'use_bn_0': True, 'conv_dropout_0': 0.3, 'conv_filters_1': 32, 'conv_kernel_1': 5, 'conv_activation_1': 'relu', 'use_bn_1': True, 'conv_dropout_1': 0.1, 'pool_type_1': 'avg', 'global_pool': 'avg', 'dense_units_0': 96, 'dense_activation_0': 'relu', 'dense_dropout_0': 0.5}. Best is trial 31 with value: 0.84820224933687.
Best trial: 31. Best value: 0.848202:  53%|████████████████████▋                  | 53/100 [25:12<30:23, 38.81s/it, 1512.40/3600 seconds]
🔍 Trial 53: Starting architecture search...
🔧 Applying data augmentation (factor: 3x)...
✅ Data augmentation completed: 1,758 → 5,274 samples
✅ Architecture valid: 9,188 params, 0.04MB
🚀 Training model...
Restoring model weights from the end of the best epoch: 50.
📊 Evaluating model...
⏱️  Measuring inference time...
📈 Results for Trial 53:
   Exact Match Accuracy: 0.942
   Average F1-Score: 0.984
   Parameters: 9,188
   Model Size: 0.04MB
   Inference Time: 27.23ms
   Combined Score: 0.841
[I 2025-10-16 14:12:01,299] Trial 53 finished with value: 0.8407751936339523 and parameters: {'num_conv_layers': 2, 'num_dense_layers': 1, 'conv_filters_0': 32, 'conv_kernel_0': 3, 'conv_activation_0': 'swish', 'use_bn_0': True, 'conv_dropout_0': 0.3, 'conv_filters_1': 32, 'conv_kernel_1': 5, 'conv_activation_1': 'relu', 'use_bn_1': True, 'conv_dropout_1': 0.1, 'pool_type_1': 'avg', 'global_pool': 'avg', 'dense_units_0': 96, 'dense_activation_0': 'relu', 'dense_dropout_0': 0.5}. Best is trial 31 with value: 0.84820224933687.
Best trial: 31. Best value: 0.848202:  54%|█████████████████████                  | 54/100 [25:42<27:46, 36.24s/it, 1542.64/3600 seconds]
🔍 Trial 54: Starting architecture search...
🔧 Applying data augmentation (factor: 3x)...
✅ Data augmentation completed: 1,758 → 5,274 samples
✅ Architecture valid: 9,188 params, 0.04MB
🚀 Training model...

Epoch 35: ReduceLROnPlateau reducing learning rate to 0.0005000000237487257.
Restoring model weights from the end of the best epoch: 50.
📊 Evaluating model...
⏱️  Measuring inference time...
📈 Results for Trial 54:
   Exact Match Accuracy: 0.931
   Average F1-Score: 0.986
   Parameters: 9,188
   Model Size: 0.04MB
   Inference Time: 28.19ms
   Combined Score: 0.833
[I 2025-10-16 14:12:31,877] Trial 54 finished with value: 0.8333481379310345 and parameters: {'num_conv_layers': 2, 'num_dense_layers': 1, 'conv_filters_0': 32, 'conv_kernel_0': 3, 'conv_activation_0': 'swish', 'use_bn_0': True, 'conv_dropout_0': 0.3, 'conv_filters_1': 32, 'conv_kernel_1': 5, 'conv_activation_1': 'relu', 'use_bn_1': True, 'conv_dropout_1': 0.1, 'pool_type_1': 'avg', 'global_pool': 'avg', 'dense_units_0': 96, 'dense_activation_0': 'relu', 'dense_dropout_0': 0.5}. Best is trial 31 with value: 0.84820224933687.
Best trial: 31. Best value: 0.848202:  55%|█████████████████████▍                 | 55/100 [26:13<25:54, 34.54s/it, 1573.22/3600 seconds]
🔍 Trial 55: Starting architecture search...
🔧 Applying data augmentation (factor: 3x)...
✅ Data augmentation completed: 1,758 → 5,274 samples
✅ Architecture valid: 9,188 params, 0.04MB
🚀 Training model...
❌ Trial 55 failed: Arguments `target` and `output` must have the same rank (ndim). Received: target.shape=(None, 4), output.shape=(None, 64, 4)
[I 2025-10-16 14:12:32,725] Trial 55 finished with value: 0.0 and parameters: {'num_conv_layers': 2, 'num_dense_layers': 1, 'conv_filters_0': 32, 'conv_kernel_0': 3, 'conv_activation_0': 'swish', 'use_bn_0': True, 'conv_dropout_0': 0.3, 'conv_filters_1': 32, 'conv_kernel_1': 5, 'conv_activation_1': 'relu', 'use_bn_1': True, 'conv_dropout_1': 0.1, 'pool_type_1': 'avg', 'global_pool': 'adaptive', 'dense_units_0': 96, 'dense_activation_0': 'relu', 'dense_dropout_0': 0.5}. Best is trial 31 with value: 0.84820224933687.
Best trial: 31. Best value: 0.848202:  56%|█████████████████████▊                 | 56/100 [26:14<17:55, 24.43s/it, 1574.06/3600 seconds]
🔍 Trial 56: Starting architecture search...
🔧 Applying data augmentation (factor: 3x)...
✅ Data augmentation completed: 1,758 → 5,274 samples
✅ Architecture valid: 51,620 params, 0.20MB
🚀 Training model...

Epoch 49: ReduceLROnPlateau reducing learning rate to 0.0005000000237487257.
Restoring model weights from the end of the best epoch: 50.
📊 Evaluating model...
⏱️  Measuring inference time...
📈 Results for Trial 56:
   Exact Match Accuracy: 0.958
   Average F1-Score: 0.987
   Parameters: 51,620
   Model Size: 0.20MB
   Inference Time: 29.35ms
   Combined Score: 0.767
[I 2025-10-16 14:13:43,074] Trial 56 finished with value: 0.767051777188329 and parameters: {'num_conv_layers': 2, 'num_dense_layers': 3, 'conv_filters_0': 160, 'conv_kernel_0': 3, 'conv_activation_0': 'swish', 'use_bn_0': True, 'conv_dropout_0': 0.3, 'conv_filters_1': 64, 'conv_kernel_1': 3, 'conv_activation_1': 'relu', 'use_bn_1': False, 'conv_dropout_1': 0.3, 'pool_type_1': 'avg', 'global_pool': 'avg', 'dense_units_0': 32, 'dense_activation_0': 'leaky_relu', 'dense_dropout_0': 0.3, 'dense_units_1': 128, 'dense_activation_1': 'relu', 'dense_dropout_1': 0.3, 'dense_units_2': 96, 'dense_activation_2': 'relu', 'dense_dropout_2': 0.4}. Best is trial 31 with value: 0.84820224933687.
Best trial: 31. Best value: 0.848202:  57%|██████████████████████▏                | 57/100 [27:24<27:22, 38.21s/it, 1644.41/3600 seconds]
🔍 Trial 57: Starting architecture search...
🔧 Applying data augmentation (factor: 3x)...
✅ Data augmentation completed: 1,758 → 5,274 samples
✅ Architecture valid: 68,436 params, 0.26MB
🚀 Training model...

Epoch 28: ReduceLROnPlateau reducing learning rate to 0.0005000000237487257.

Epoch 45: ReduceLROnPlateau reducing learning rate to 0.0002500000118743628.
Restoring model weights from the end of the best epoch: 50.
📊 Evaluating model...
⏱️  Measuring inference time...
📈 Results for Trial 57:
   Exact Match Accuracy: 0.976
   Average F1-Score: 0.996
   Parameters: 68,436
   Model Size: 0.26MB
   Inference Time: 31.68ms
   Combined Score: 0.746
[I 2025-10-16 14:15:34,652] Trial 57 finished with value: 0.7464171246684349 and parameters: {'num_conv_layers': 5, 'num_dense_layers': 1, 'conv_filters_0': 144, 'conv_kernel_0': 7, 'conv_activation_0': 'gelu', 'use_bn_0': True, 'conv_dropout_0': 0.3, 'conv_filters_1': 32, 'conv_kernel_1': 5, 'conv_activation_1': 'gelu', 'use_bn_1': True, 'conv_dropout_1': 0.1, 'pool_type_1': 'avg', 'conv_filters_2': 64, 'conv_kernel_2': 5, 'conv_activation_2': 'leaky_relu', 'use_bn_2': True, 'conv_dropout_2': 0.3, 'conv_filters_3': 32, 'conv_kernel_3': 9, 'conv_activation_3': 'leaky_relu', 'use_bn_3': True, 'conv_dropout_3': 0.2, 'pool_type_3': 'avg', 'conv_filters_4': 48, 'conv_kernel_4': 7, 'conv_activation_4': 'relu', 'use_bn_4': False, 'conv_dropout_4': 0.2, 'global_pool': 'avg', 'dense_units_0': 48, 'dense_activation_0': 'relu', 'dense_dropout_0': 0.5}. Best is trial 31 with value: 0.84820224933687.
Best trial: 31. Best value: 0.848202:  58%|██████████████████████▌                | 58/100 [29:15<42:09, 60.22s/it, 1755.99/3600 seconds]
🔍 Trial 58: Starting architecture search...
🔧 Applying data augmentation (factor: 3x)...
✅ Data augmentation completed: 1,758 → 5,274 samples
✅ Architecture valid: 43,188 params, 0.16MB
🚀 Training model...

Epoch 37: ReduceLROnPlateau reducing learning rate to 0.0005000000237487257.

Epoch 49: ReduceLROnPlateau reducing learning rate to 0.0002500000118743628.
Restoring model weights from the end of the best epoch: 42.
📊 Evaluating model...
⏱️  Measuring inference time...
📈 Results for Trial 58:
   Exact Match Accuracy: 0.968
   Average F1-Score: 0.993
   Parameters: 43,188
   Model Size: 0.16MB
   Inference Time: 30.80ms
   Combined Score: 0.791
[I 2025-10-16 14:16:42,798] Trial 58 finished with value: 0.7913428328912466 and parameters: {'num_conv_layers': 2, 'num_dense_layers': 1, 'conv_filters_0': 32, 'conv_kernel_0': 3, 'conv_activation_0': 'swish', 'use_bn_0': True, 'conv_dropout_0': 0.1, 'conv_filters_1': 144, 'conv_kernel_1': 5, 'conv_activation_1': 'relu', 'use_bn_1': True, 'conv_dropout_1': 0.1, 'pool_type_1': 'max', 'global_pool': 'avg', 'dense_units_0': 128, 'dense_activation_0': 'relu', 'dense_dropout_0': 0.3}. Best is trial 31 with value: 0.84820224933687.
Best trial: 31. Best value: 0.848202:  59%|███████████████████████                | 59/100 [30:24<42:46, 62.60s/it, 1824.14/3600 seconds]
🔍 Trial 59: Starting architecture search...
🔧 Applying data augmentation (factor: 3x)...
✅ Data augmentation completed: 1,758 → 5,274 samples
❌ Too many parameters: 228,916 > 100,000
[I 2025-10-16 14:16:43,629] Trial 59 pruned.                                                                                             
Best trial: 31. Best value: 0.848202:  60%|███████████████████████▍               | 60/100 [30:24<29:22, 44.07s/it, 1824.97/3600 seconds]
🔍 Trial 60: Starting architecture search...
🔧 Applying data augmentation (factor: 3x)...
✅ Data augmentation completed: 1,758 → 5,274 samples
❌ Too many parameters: 113,092 > 100,000
[I 2025-10-16 14:16:44,440] Trial 60 pruned.                                                                                             
Best trial: 31. Best value: 0.848202:  61%|███████████████████████▊               | 61/100 [30:25<20:12, 31.09s/it, 1825.78/3600 seconds]
🔍 Trial 61: Starting architecture search...
🔧 Applying data augmentation (factor: 3x)...
✅ Data augmentation completed: 1,758 → 5,274 samples
✅ Architecture valid: 9,188 params, 0.04MB
🚀 Training model...

Epoch 24: ReduceLROnPlateau reducing learning rate to 0.0005000000237487257.
Restoring model weights from the end of the best epoch: 50.
📊 Evaluating model...
⏱️  Measuring inference time...
📈 Results for Trial 61:
   Exact Match Accuracy: 0.952
   Average F1-Score: 0.985
   Parameters: 9,188
   Model Size: 0.04MB
   Inference Time: 36.87ms
   Combined Score: 0.848
[I 2025-10-16 14:17:21,399] Trial 61 finished with value: 0.84820224933687 and parameters: {'num_conv_layers': 2, 'num_dense_layers': 1, 'conv_filters_0': 32, 'conv_kernel_0': 3, 'conv_activation_0': 'swish', 'use_bn_0': True, 'conv_dropout_0': 0.3, 'conv_filters_1': 32, 'conv_kernel_1': 5, 'conv_activation_1': 'relu', 'use_bn_1': True, 'conv_dropout_1': 0.1, 'pool_type_1': 'avg', 'global_pool': 'avg', 'dense_units_0': 96, 'dense_activation_0': 'relu', 'dense_dropout_0': 0.5}. Best is trial 31 with value: 0.84820224933687.
Best trial: 31. Best value: 0.848202:  62%|████████████████████████▏              | 62/100 [31:02<20:48, 32.85s/it, 1862.74/3600 seconds]
🔍 Trial 62: Starting architecture search...
🔧 Applying data augmentation (factor: 3x)...
✅ Data augmentation completed: 1,758 → 5,274 samples
✅ Architecture valid: 9,188 params, 0.04MB
🚀 Training model...
Restoring model weights from the end of the best epoch: 50.
📊 Evaluating model...
⏱️  Measuring inference time...
📈 Results for Trial 62:
   Exact Match Accuracy: 0.944
   Average F1-Score: 0.984
   Parameters: 9,188
   Model Size: 0.04MB
   Inference Time: 29.28ms
   Combined Score: 0.843
