[I 2025-10-16 14:40:09,837] Trial 99 finished with value: 0.8455111936339522 and parameters: {'num_conv_layers': 2, 'num_dense_layers': 1, 'conv_filters_0': 32, 'conv_kernel_0': 3, 'conv_activation_0': 'relu', 'use_bn_0': True, 'conv_dropout_0': 0.3, 'conv_filters_1': 32, 'conv_kernel_1': 5, 'conv_activation_1': 'gelu', 'use_bn_1': True, 'conv_dropout_1': 0.3, 'pool_type_1': 'avg', 'global_pool': 'avg', 'dense_units_0': 32, 'dense_activation_0': 'relu', 'dense_dropout_0': 0.5}. Best is trial 69 with value: 0.8556293050397877.
Best trial: 69. Best value: 0.855629: 100%|██████████████████████████████████████| 100/100 [53:51<00:00, 32.31s/it, 3231.18/3600 seconds]

🎉 NAS Search completed!
⏱️  Total time: 0.90 hours
🔍 Completed trials: 100

📊 Analyzing NAS search results...

🏆 Best Architecture Found:
   Combined Score: 0.856
   Exact Match Accuracy: 0.963
   Parameters: 9,188
   Model Size: 0.04MB
   Inference Time: 27.94ms

🏗️  Best Architecture:
   Conv Layers: 2
   Dense Layers: 1
   Global Pooling: avg

📈 Performance Distribution:
   Accuracy - Min: 0.000, Max: 0.995, Mean: 0.858
   Parameters - Min: 0, Max: 84,292, Mean: 20,096

📊 Analyzing NAS search results...

🏆 Best Architecture Found:
   Combined Score: 0.856
   Exact Match Accuracy: 0.963
   Parameters: 9,188
   Model Size: 0.04MB
   Inference Time: 27.94ms

🏗️  Best Architecture:
   Conv Layers: 2
   Dense Layers: 1
   Global Pooling: avg

📈 Performance Distribution:
   Accuracy - Min: 0.000, Max: 0.995, Mean: 0.858
   Parameters - Min: 0, Max: 84,292, Mean: 20,096
💾 NAS results saved to results/nas_search_results.json
💾 NAS study saved to results/nas_search_results_study.pkl
💾 NAS results saved to results/nas_search_results.json

🎉 Full NAS search completed!
Duration: 0.90 hours
Best score: 0.856
Best accuracy: 0.9628647214854111
Best parameters: 9,188

🏆 Training best NAS architecture for final evaluation...
🔄 Loading datasets...
📊 Loaded 1,758 samples from sdr_wifi_train.h5
📊 Loaded 377 samples from sdr_wifi_val.h5
📊 Loaded 377 samples from sdr_wifi_test.h5
✅ All datasets loaded successfully!
🔧 Applying data augmentation (factor: 3x)...
✅ Data augmentation completed: 1,758 → 5,274 samples
✅ Built best architecture: 9,188 parameters
🚀 Training for 100 epochs...

Epoch 43: ReduceLROnPlateau reducing learning rate to 0.0005000000237487257.

Epoch 55: ReduceLROnPlateau reducing learning rate to 0.0002500000118743628.

Epoch 62: ReduceLROnPlateau reducing learning rate to 0.0001250000059371814.
Epoch 63: early stopping
Restoring model weights from the end of the best epoch: 48.
📊 Final evaluation...

🎉 Final Model Results:
   Exact Match Accuracy: 0.966
   Average F1-Score: 0.994
   Average AUC: 1.000
   Parameters: 9,188
   Model Size: 0.04MB
WARNING:absl:You are saving your model as an HDF5 file via `model.save()` or `keras.saving.save_model(model)`. This file format is considered legacy. We recommend using instead the native Keras format, e.g. `model.save('my_model.keras')` or `keras.saving.save_model(model, 'my_model.keras')`. 
💾 Final model saved to /Users/jaime07ag/Library/Mobile Documents/com~apple~CloudDocs/Downloads/Elva/Spectrum_Sensing_NAS/config/../models/nas_final_model.h5
📊 Running NAS evaluation...
📊 Neural Architecture Search Evaluation
==================================================
WARNING:absl:Compiled the loaded model, but the compiled metrics have yet to be built. `model.compile_metrics` will be empty until you train or evaluate the model.
✅ Loaded best NAS model from /Users/jaime07ag/Library/Mobile Documents/com~apple~CloudDocs/Downloads/Elva/Spectrum_Sensing_NAS/code/../config/../models/nas_final_model.h5
✅ Loaded NAS results from /Users/jaime07ag/Library/Mobile Documents/com~apple~CloudDocs/Downloads/Elva/Spectrum_Sensing_NAS/code/../config/../results/nas_search_results.json
📊 Running comprehensive NAS model evaluation...
🔄 Loading datasets...
📊 Loaded 1,758 samples from sdr_wifi_train.h5
📊 Loaded 377 samples from sdr_wifi_val.h5
📊 Loaded 377 samples from sdr_wifi_test.h5
✅ All datasets loaded successfully!
🔮 Generating predictions...

 1/12 ━━━━━━━━━━━━━━━━━━━━ 1s 95ms/step
12/12 ━━━━━━━━━━━━━━━━━━━━ 0s 5ms/step 
12/12 ━━━━━━━━━━━━━━━━━━━━ 0s 6ms/step
/Users/jaime07ag/Library/Mobile Documents/com~apple~CloudDocs/Downloads/Elva/Spectrum_Sensing_NAS/venv/lib/python3.9/site-packages/sklearn/metrics/_classification.py:1565: UndefinedMetricWarning: Jaccard is ill-defined and being set to 0.0 in samples with no true or predicted labels. Use `zero_division` parameter to control this behavior.
  _warn_prf(average, modifier, f"{metric.capitalize()} is", len(result))
/Users/jaime07ag/Library/Mobile Documents/com~apple~CloudDocs/Downloads/Elva/Spectrum_Sensing_NAS/venv/lib/python3.9/site-packages/sklearn/metrics/_ranking.py:1188: UndefinedMetricWarning: No positive samples in y_true, true positive value should be meaningless
  warnings.warn(
📈 Calculating global metrics...
📊 Analyzing per-channel performance...
📊 Creating visualization plots...
✅ Plots saved to /Users/jaime07ag/Library/Mobile Documents/com~apple~CloudDocs/Downloads/Elva/Spectrum_Sensing_NAS/code/../config/../results
📊 Creating comparison plot with baseline CNN...
✅ Comparison plot saved to /Users/jaime07ag/Library/Mobile Documents/com~apple~CloudDocs/Downloads/Elva/Spectrum_Sensing_NAS/code/../config/../results
📝 Generating comprehensive NAS evaluation report...
📝 NAS report saved to /Users/jaime07ag/Library/Mobile Documents/com~apple~CloudDocs/Downloads/Elva/Spectrum_Sensing_NAS/code/../config/../results/nas_evaluation_report.md
💾 NAS results saved to /Users/jaime07ag/Library/Mobile Documents/com~apple~CloudDocs/Downloads/Elva/Spectrum_Sensing_NAS/code/../config/../results/nas_comprehensive_evaluation.json

🎉 NAS evaluation completed successfully!
📁 Results saved in:
   - /Users/jaime07ag/Library/Mobile Documents/com~apple~CloudDocs/Downloads/Elva/Spectrum_Sensing_NAS/code/../config/../results/nas_evaluation_report.md
   - /Users/jaime07ag/Library/Mobile Documents/com~apple~CloudDocs/Downloads/Elva/Spectrum_Sensing_NAS/code/../config/../results/nas_comprehensive_evaluation.json
   - /Users/jaime07ag/Library/Mobile Documents/com~apple~CloudDocs/Downloads/Elva/Spectrum_Sensing_NAS/code/../config/../results/*.png
(venv) jaime07ag@MacBook-Pro-de-Jaime Spectrum_Sensing_NAS % 