[I 2025-10-16 13:54:19,499] Trial 20 finished with value: 0.77154849867374 and parameters: {'num_conv_layers': 2, 'num_dense_layers': 2, 'conv_filters_0': 160, 'conv_kernel_0': 3, 'conv_activation_0': 'swish', 'use_bn_0': True, 'conv_dropout_0': 0.5, 'conv_filters_1': 32, 'conv_kernel_1': 5, 'conv_activation_1': 'swish', 'use_bn_1': True, 'conv_dropout_1': 0.1, 'pool_type_1': 'avg', 'global_pool': 'max', 'dense_units_0': 48, 'dense_activation_0': 'relu', 'dense_dropout_0': 0.3, 'dense_units_1': 32, 'dense_activation_1': 'swish', 'dense_dropout_1': 0.3}. Best is trial 15 with value: 0.8387279575596817.
Best trial: 15. Best value: 0.838728:  21%|███████▉                              | 21/100 [08:00<1:13:44, 56.01s/it, 480.84/3600 seconds]
🔍 Trial 21: Starting architecture search...
🔧 Applying data augmentation (factor: 3x)...
✅ Data augmentation completed: 1,758 → 5,274 samples
✅ Architecture valid: 14,372 params, 0.05MB
🚀 Training model...

Epoch 46: ReduceLROnPlateau reducing learning rate to 0.0005000000237487257.
Restoring model weights from the end of the best epoch: 39.
📊 Evaluating model...
⏱️  Measuring inference time...
📈 Results for Trial 21:
   Exact Match Accuracy: 0.915
   Average F1-Score: 0.974
   Parameters: 14,372
   Model Size: 0.05MB
   Inference Time: 29.44ms
   Combined Score: 0.812
[I 2025-10-16 13:54:57,684] Trial 21 finished with value: 0.8118395543766579 and parameters: {'num_conv_layers': 2, 'num_dense_layers': 2, 'conv_filters_0': 32, 'conv_kernel_0': 3, 'conv_activation_0': 'swish', 'use_bn_0': True, 'conv_dropout_0': 0.3, 'conv_filters_1': 32, 'conv_kernel_1': 5, 'conv_activation_1': 'relu', 'use_bn_1': True, 'conv_dropout_1': 0.1, 'pool_type_1': 'avg', 'global_pool': 'max', 'dense_units_0': 64, 'dense_activation_0': 'relu', 'dense_dropout_0': 0.4, 'dense_units_1': 96, 'dense_activation_1': 'swish', 'dense_dropout_1': 0.4}. Best is trial 15 with value: 0.8387279575596817.
Best trial: 15. Best value: 0.838728:  22%|████████▎                             | 22/100 [08:39<1:05:51, 50.66s/it, 519.02/3600 seconds]
🔍 Trial 22: Starting architecture search...
🔧 Applying data augmentation (factor: 3x)...
✅ Data augmentation completed: 1,758 → 5,274 samples
✅ Architecture valid: 14,372 params, 0.05MB
🚀 Training model...

Epoch 43: ReduceLROnPlateau reducing learning rate to 0.0005000000237487257.

Epoch 50: ReduceLROnPlateau reducing learning rate to 0.0002500000118743628.
Restoring model weights from the end of the best epoch: 36.
📊 Evaluating model...
⏱️  Measuring inference time...
📈 Results for Trial 22:
   Exact Match Accuracy: 0.883
   Average F1-Score: 0.967
   Parameters: 14,372
   Model Size: 0.05MB
   Inference Time: 29.87ms
   Combined Score: 0.790
[I 2025-10-16 13:55:32,860] Trial 22 finished with value: 0.7895583872679044 and parameters: {'num_conv_layers': 2, 'num_dense_layers': 2, 'conv_filters_0': 32, 'conv_kernel_0': 3, 'conv_activation_0': 'swish', 'use_bn_0': True, 'conv_dropout_0': 0.3, 'conv_filters_1': 32, 'conv_kernel_1': 5, 'conv_activation_1': 'relu', 'use_bn_1': True, 'conv_dropout_1': 0.1, 'pool_type_1': 'avg', 'global_pool': 'max', 'dense_units_0': 64, 'dense_activation_0': 'relu', 'dense_dropout_0': 0.4, 'dense_units_1': 96, 'dense_activation_1': 'swish', 'dense_dropout_1': 0.4}. Best is trial 15 with value: 0.8387279575596817.
Best trial: 15. Best value: 0.838728:  23%|█████████▏                              | 23/100 [09:14<59:03, 46.01s/it, 554.20/3600 seconds]
🔍 Trial 23: Starting architecture search...
🔧 Applying data augmentation (factor: 3x)...
✅ Data augmentation completed: 1,758 → 5,274 samples
✅ Architecture valid: 14,372 params, 0.05MB
🚀 Training model...

Epoch 44: ReduceLROnPlateau reducing learning rate to 0.0005000000237487257.
Restoring model weights from the end of the best epoch: 37.
📊 Evaluating model...
⏱️  Measuring inference time...
📈 Results for Trial 23:
   Exact Match Accuracy: 0.918
   Average F1-Score: 0.975
   Parameters: 14,372
   Model Size: 0.05MB
   Inference Time: 29.56ms
   Combined Score: 0.814
[I 2025-10-16 13:56:06,493] Trial 23 finished with value: 0.8136963183023873 and parameters: {'num_conv_layers': 2, 'num_dense_layers': 2, 'conv_filters_0': 32, 'conv_kernel_0': 3, 'conv_activation_0': 'swish', 'use_bn_0': True, 'conv_dropout_0': 0.3, 'conv_filters_1': 32, 'conv_kernel_1': 5, 'conv_activation_1': 'relu', 'use_bn_1': True, 'conv_dropout_1': 0.1, 'pool_type_1': 'avg', 'global_pool': 'max', 'dense_units_0': 64, 'dense_activation_0': 'relu', 'dense_dropout_0': 0.4, 'dense_units_1': 96, 'dense_activation_1': 'swish', 'dense_dropout_1': 0.4}. Best is trial 15 with value: 0.8387279575596817.
Best trial: 15. Best value: 0.838728:  24%|█████████▌                              | 24/100 [09:47<53:34, 42.30s/it, 587.83/3600 seconds]
🔍 Trial 24: Starting architecture search...
🔧 Applying data augmentation (factor: 3x)...
✅ Data augmentation completed: 1,758 → 5,274 samples
✅ Architecture valid: 56,036 params, 0.21MB
🚀 Training model...

Epoch 40: ReduceLROnPlateau reducing learning rate to 0.0005000000237487257.

Epoch 47: ReduceLROnPlateau reducing learning rate to 0.0002500000118743628.
Epoch 48: early stopping
Restoring model weights from the end of the best epoch: 33.
📊 Evaluating model...
⏱️  Measuring inference time...
📈 Results for Trial 24:
   Exact Match Accuracy: 0.934
   Average F1-Score: 0.984
   Parameters: 56,036
   Model Size: 0.21MB
   Inference Time: 30.35ms
   Combined Score: 0.742
[I 2025-10-16 13:57:24,565] Trial 24 finished with value: 0.7415089018567639 and parameters: {'num_conv_layers': 2, 'num_dense_layers': 2, 'conv_filters_0': 96, 'conv_kernel_0': 3, 'conv_activation_0': 'swish', 'use_bn_0': True, 'conv_dropout_0': 0.4, 'conv_filters_1': 96, 'conv_kernel_1': 5, 'conv_activation_1': 'relu', 'use_bn_1': True, 'conv_dropout_1': 0.1, 'pool_type_1': 'avg', 'global_pool': 'max', 'dense_units_0': 64, 'dense_activation_0': 'relu', 'dense_dropout_0': 0.4, 'dense_units_1': 32, 'dense_activation_1': 'swish', 'dense_dropout_1': 0.4}. Best is trial 15 with value: 0.8387279575596817.
Best trial: 15. Best value: 0.838728:  25%|█████████▌                            | 25/100 [11:05<1:06:17, 53.03s/it, 665.91/3600 seconds]
🔍 Trial 25: Starting architecture search...
🔧 Applying data augmentation (factor: 3x)...
✅ Data augmentation completed: 1,758 → 5,274 samples
❌ Too many parameters: 199,140 > 100,000
[I 2025-10-16 13:57:25,358] Trial 25 pruned.                                                                                             
Best trial: 15. Best value: 0.838728:  26%|██████████▍                             | 26/100 [11:06<46:04, 37.36s/it, 666.70/3600 seconds]
🔍 Trial 26: Starting architecture search...
🔧 Applying data augmentation (factor: 3x)...
✅ Data augmentation completed: 1,758 → 5,274 samples
❌ Too many parameters: 123,924 > 100,000
[I 2025-10-16 13:57:26,110] Trial 26 pruned.                                                                                             
Best trial: 15. Best value: 0.838728:  27%|██████████▊                             | 27/100 [11:07<32:05, 26.38s/it, 667.45/3600 seconds]
🔍 Trial 27: Starting architecture search...
🔧 Applying data augmentation (factor: 3x)...
✅ Data augmentation completed: 1,758 → 5,274 samples
✅ Architecture valid: 84,292 params, 0.32MB
🚀 Training model...

Epoch 32: ReduceLROnPlateau reducing learning rate to 0.0005000000237487257.
Restoring model weights from the end of the best epoch: 50.
📊 Evaluating model...
⏱️  Measuring inference time...
📈 Results for Trial 27:
   Exact Match Accuracy: 0.934
   Average F1-Score: 0.980
   Parameters: 84,292
   Model Size: 0.32MB
   Inference Time: 31.38ms
   Combined Score: 0.685
[I 2025-10-16 13:59:11,586] Trial 27 finished with value: 0.6849969018567639 and parameters: {'num_conv_layers': 2, 'num_dense_layers': 2, 'conv_filters_0': 64, 'conv_kernel_0': 3, 'conv_activation_0': 'swish', 'use_bn_0': True, 'conv_dropout_0': 0.3, 'conv_filters_1': 192, 'conv_kernel_1': 5, 'conv_activation_1': 'swish', 'use_bn_1': True, 'conv_dropout_1': 0.4, 'pool_type_1': 'avg', 'global_pool': 'max', 'dense_units_0': 64, 'dense_activation_0': 'relu', 'dense_dropout_0': 0.4, 'dense_units_1': 128, 'dense_activation_1': 'swish', 'dense_dropout_1': 0.3}. Best is trial 15 with value: 0.8387279575596817.
Best trial: 15. Best value: 0.838728:  28%|██████████▋                           | 28/100 [12:52<1:00:07, 50.11s/it, 772.93/3600 seconds]
🔍 Trial 28: Starting architecture search...
🔧 Applying data augmentation (factor: 3x)...
✅ Data augmentation completed: 1,758 → 5,274 samples
❌ Too many parameters: 109,604 > 100,000
[I 2025-10-16 13:59:12,393] Trial 28 pruned.                                                                                             
Best trial: 15. Best value: 0.838728:  29%|███████████▌                            | 29/100 [12:53<41:47, 35.32s/it, 773.73/3600 seconds]
🔍 Trial 29: Starting architecture search...
🔧 Applying data augmentation (factor: 3x)...
✅ Data augmentation completed: 1,758 → 5,274 samples
✅ Architecture valid: 47,156 params, 0.18MB
🚀 Training model...
Restoring model weights from the end of the best epoch: 49.
📊 Evaluating model...
⏱️  Measuring inference time...
📈 Results for Trial 29:
   Exact Match Accuracy: 0.995
   Average F1-Score: 1.000
   Parameters: 47,156
   Model Size: 0.18MB
   Inference Time: 38.08ms
   Combined Score: 0.802
[I 2025-10-16 14:00:17,161] Trial 29 finished with value: 0.8019744721485411 and parameters: {'num_conv_layers': 4, 'num_dense_layers': 1, 'conv_filters_0': 32, 'conv_kernel_0': 3, 'conv_activation_0': 'swish', 'use_bn_0': False, 'conv_dropout_0': 0.1, 'conv_filters_1': 32, 'conv_kernel_1': 9, 'conv_activation_1': 'relu', 'use_bn_1': True, 'conv_dropout_1': 0.1, 'pool_type_1': 'max', 'conv_filters_2': 64, 'conv_kernel_2': 3, 'conv_activation_2': 'swish', 'use_bn_2': True, 'conv_dropout_2': 0.2, 'conv_filters_3': 48, 'conv_kernel_3': 9, 'conv_activation_3': 'leaky_relu', 'use_bn_3': False, 'conv_dropout_3': 0.3, 'pool_type_3': 'avg', 'global_pool': 'max', 'dense_units_0': 64, 'dense_activation_0': 'relu', 'dense_dropout_0': 0.3}. Best is trial 15 with value: 0.8387279575596817.
Best trial: 15. Best value: 0.838728:  30%|████████████                            | 30/100 [13:58<51:30, 44.15s/it, 838.50/3600 seconds]
🔍 Trial 30: Starting architecture search...
🔧 Applying data augmentation (factor: 3x)...
✅ Data augmentation completed: 1,758 → 5,274 samples
✅ Architecture valid: 9,188 params, 0.04MB
🚀 Training model...
Restoring model weights from the end of the best epoch: 46.
📊 Evaluating model...
⏱️  Measuring inference time...
📈 Results for Trial 30:
   Exact Match Accuracy: 0.936
   Average F1-Score: 0.980
   Parameters: 9,188
   Model Size: 0.04MB
   Inference Time: 36.33ms
   Combined Score: 0.837
[I 2025-10-16 14:00:55,522] Trial 30 finished with value: 0.8370616657824933 and parameters: {'num_conv_layers': 2, 'num_dense_layers': 1, 'conv_filters_0': 32, 'conv_kernel_0': 3, 'conv_activation_0': 'swish', 'use_bn_0': True, 'conv_dropout_0': 0.3, 'conv_filters_1': 32, 'conv_kernel_1': 5, 'conv_activation_1': 'relu', 'use_bn_1': True, 'conv_dropout_1': 0.1, 'pool_type_1': 'avg', 'global_pool': 'avg', 'dense_units_0': 96, 'dense_activation_0': 'relu', 'dense_dropout_0': 0.5}. Best is trial 15 with value: 0.8387279575596817.
Best trial: 15. Best value: 0.838728:  31%|████████████▍                           | 31/100 [14:36<48:46, 42.42s/it, 876.86/3600 seconds]
🔍 Trial 31: Starting architecture search...
🔧 Applying data augmentation (factor: 3x)...
✅ Data augmentation completed: 1,758 → 5,274 samples
✅ Architecture valid: 9,188 params, 0.04MB
🚀 Training model...
Restoring model weights from the end of the best epoch: 50.
📊 Evaluating model...
⏱️  Measuring inference time...
📈 Results for Trial 31:
   Exact Match Accuracy: 0.952
   Average F1-Score: 0.986
   Parameters: 9,188
   Model Size: 0.04MB
   Inference Time: 29.17ms
   Combined Score: 0.848
[I 2025-10-16 14:01:29,698] Trial 31 finished with value: 0.84820224933687 and parameters: {'num_conv_layers': 2, 'num_dense_layers': 1, 'conv_filters_0': 32, 'conv_kernel_0': 3, 'conv_activation_0': 'swish', 'use_bn_0': True, 'conv_dropout_0': 0.3, 'conv_filters_1': 32, 'conv_kernel_1': 5, 'conv_activation_1': 'relu', 'use_bn_1': True, 'conv_dropout_1': 0.1, 'pool_type_1': 'avg', 'global_pool': 'avg', 'dense_units_0': 96, 'dense_activation_0': 'relu', 'dense_dropout_0': 0.5}. Best is trial 31 with value: 0.84820224933687.
Best trial: 31. Best value: 0.848202:  32%|████████████▊                           | 32/100 [15:11<45:16, 39.94s/it, 911.04/3600 seconds]
🔍 Trial 32: Starting architecture search...
🔧 Applying data augmentation (factor: 3x)...
✅ Data augmentation completed: 1,758 → 5,274 samples
✅ Architecture valid: 9,188 params, 0.04MB
🚀 Training model...
Restoring model weights from the end of the best epoch: 50.
📊 Evaluating model...
⏱️  Measuring inference time...
📈 Results for Trial 32:
   Exact Match Accuracy: 0.947
   Average F1-Score: 0.984
   Parameters: 9,188
   Model Size: 0.04MB
   Inference Time: 29.44ms
   Combined Score: 0.844
[I 2025-10-16 14:02:01,649] Trial 32 finished with value: 0.8444887214854111 and parameters: {'num_conv_layers': 2, 'num_dense_layers': 1, 'conv_filters_0': 32, 'conv_kernel_0': 3, 'conv_activation_0': 'swish', 'use_bn_0': True, 'conv_dropout_0': 0.3, 'conv_filters_1': 32, 'conv_kernel_1': 5, 'conv_activation_1': 'relu', 'use_bn_1': True, 'conv_dropout_1': 0.1, 'pool_type_1': 'avg', 'global_pool': 'avg', 'dense_units_0': 96, 'dense_activation_0': 'relu', 'dense_dropout_0': 0.5}. Best is trial 31 with value: 0.84820224933687.
Best trial: 31. Best value: 0.848202:  33%|█████████████▏                          | 33/100 [15:42<41:55, 37.55s/it, 942.99/3600 seconds]
🔍 Trial 33: Starting architecture search...
🔧 Applying data augmentation (factor: 3x)...
✅ Data augmentation completed: 1,758 → 5,274 samples
✅ Architecture valid: 9,188 params, 0.04MB
🚀 Training model...
Restoring model weights from the end of the best epoch: 46.
📊 Evaluating model...
⏱️  Measuring inference time...
📈 Results for Trial 33:
   Exact Match Accuracy: 0.952
   Average F1-Score: 0.987
   Parameters: 9,188
   Model Size: 0.04MB
   Inference Time: 27.60ms
   Combined Score: 0.848
[I 2025-10-16 14:02:31,691] Trial 33 finished with value: 0.84820224933687 and parameters: {'num_conv_layers': 2, 'num_dense_layers': 1, 'conv_filters_0': 32, 'conv_kernel_0': 3, 'conv_activation_0': 'relu', 'use_bn_0': True, 'conv_dropout_0': 0.4, 'conv_filters_1': 32, 'conv_kernel_1': 5, 'conv_activation_1': 'relu', 'use_bn_1': True, 'conv_dropout_1': 0.2, 'pool_type_1': 'avg', 'global_pool': 'avg', 'dense_units_0': 96, 'dense_activation_0': 'relu', 'dense_dropout_0': 0.5}. Best is trial 31 with value: 0.84820224933687.
Best trial: 31. Best value: 0.848202:  34%|█████████████▌                          | 34/100 [16:13<38:49, 35.29s/it, 973.03/3600 seconds]
🔍 Trial 34: Starting architecture search...
🔧 Applying data augmentation (factor: 3x)...
✅ Data augmentation completed: 1,758 → 5,274 samples
❌ Too many parameters: 105,988 > 100,000
[I 2025-10-16 14:02:32,415] Trial 34 pruned.                                                                                             
Best trial: 31. Best value: 0.848202:  35%|██████████████                          | 35/100 [16:13<27:00, 24.92s/it, 973.75/3600 seconds]
🔍 Trial 35: Starting architecture search...
🔧 Applying data augmentation (factor: 3x)...
✅ Data augmentation completed: 1,758 → 5,274 samples
❌ Too many parameters: 181,812 > 100,000
[I 2025-10-16 14:02:33,132] Trial 35 pruned.                                                                                             
Best trial: 31. Best value: 0.848202:  36%|██████████████▍                         | 36/100 [16:14<18:50, 17.66s/it, 974.47/3600 seconds]
🔍 Trial 36: Starting architecture search...
🔧 Applying data augmentation (factor: 3x)...
✅ Data augmentation completed: 1,758 → 5,274 samples
✅ Architecture valid: 44,324 params, 0.17MB
🚀 Training model...

Epoch 26: ReduceLROnPlateau reducing learning rate to 0.0005000000237487257.

Epoch 38: ReduceLROnPlateau reducing learning rate to 0.0002500000118743628.

Epoch 46: ReduceLROnPlateau reducing learning rate to 0.0001250000059371814.
Restoring model weights from the end of the best epoch: 49.
📊 Evaluating model...
⏱️  Measuring inference time...
📈 Results for Trial 36:
   Exact Match Accuracy: 0.968
   Average F1-Score: 0.991
   Parameters: 44,324
   Model Size: 0.17MB
   Inference Time: 28.99ms
   Combined Score: 0.789
[I 2025-10-16 14:03:29,582] Trial 36 finished with value: 0.7890708328912467 and parameters: {'num_conv_layers': 3, 'num_dense_layers': 1, 'conv_filters_0': 32, 'conv_kernel_0': 9, 'conv_activation_0': 'relu', 'use_bn_0': True, 'conv_dropout_0': 0.4, 'conv_filters_1': 32, 'conv_kernel_1': 5, 'conv_activation_1': 'relu', 'use_bn_1': True, 'conv_dropout_1': 0.2, 'pool_type_1': 'avg', 'conv_filters_2': 192, 'conv_kernel_2': 3, 'conv_activation_2': 'leaky_relu', 'use_bn_2': True, 'conv_dropout_2': 0.2, 'global_pool': 'avg', 'dense_units_0': 96, 'dense_activation_0': 'swish', 'dense_dropout_0': 0.5}. Best is trial 31 with value: 0.84820224933687.
Best trial: 31. Best value: 0.848202:  37%|██████████████▍                        | 37/100 [17:10<30:45, 29.30s/it, 1030.92/3600 seconds]
🔍 Trial 37: Starting architecture search...
🔧 Applying data augmentation (factor: 3x)...
✅ Data augmentation completed: 1,758 → 5,274 samples
✅ Architecture valid: 27,796 params, 0.11MB
🚀 Training model...

Epoch 39: ReduceLROnPlateau reducing learning rate to 0.0005000000237487257.
Restoring model weights from the end of the best epoch: 49.
📊 Evaluating model...
⏱️  Measuring inference time...
📈 Results for Trial 37:
   Exact Match Accuracy: 0.963
   Average F1-Score: 0.989
   Parameters: 27,796
   Model Size: 0.11MB
   Inference Time: 28.95ms
   Combined Score: 0.818
[I 2025-10-16 14:04:15,349] Trial 37 finished with value: 0.8184133050397877 and parameters: {'num_conv_layers': 2, 'num_dense_layers': 1, 'conv_filters_0': 64, 'conv_kernel_0': 7, 'conv_activation_0': 'leaky_relu', 'use_bn_0': False, 'conv_dropout_0': 0.4, 'conv_filters_1': 48, 'conv_kernel_1': 7, 'conv_activation_1': 'relu', 'use_bn_1': True, 'conv_dropout_1': 0.2, 'pool_type_1': 'adaptive_avg', 'global_pool': 'avg', 'dense_units_0': 96, 'dense_activation_0': 'relu', 'dense_dropout_0': 0.5}. Best is trial 31 with value: 0.84820224933687.
Best trial: 31. Best value: 0.848202:  38%|██████████████▊                        | 38/100 [17:56<35:22, 34.24s/it, 1076.69/3600 seconds]
🔍 Trial 38: Starting architecture search...
🔧 Applying data augmentation (factor: 3x)...
✅ Data augmentation completed: 1,758 → 5,274 samples
❌ Too many parameters: 195,988 > 100,000
[I 2025-10-16 14:04:16,079] Trial 38 pruned.                                                                                             
Best trial: 31. Best value: 0.848202:  39%|███████████████▏                       | 39/100 [17:57<24:35, 24.19s/it, 1077.42/3600 seconds]
🔍 Trial 39: Starting architecture search...
🔧 Applying data augmentation (factor: 3x)...
✅ Data augmentation completed: 1,758 → 5,274 samples
❌ Too many parameters: 120,804 > 100,000
[I 2025-10-16 14:04:16,804] Trial 39 pruned.                                                                                             
Best trial: 31. Best value: 0.848202:  40%|███████████████▌                       | 40/100 [17:58<17:08, 17.15s/it, 1078.14/3600 seconds]
🔍 Trial 40: Starting architecture search...
🔧 Applying data augmentation (factor: 3x)...
✅ Data augmentation completed: 1,758 → 5,274 samples
❌ Too many parameters: 399,460 > 100,000
[I 2025-10-16 14:04:17,523] Trial 40 pruned.                                                                                             
Best trial: 31. Best value: 0.848202:  41%|███████████████▉                       | 41/100 [17:58<12:00, 12.22s/it, 1078.86/3600 seconds]
🔍 Trial 41: Starting architecture search...
🔧 Applying data augmentation (factor: 3x)...
✅ Data augmentation completed: 1,758 → 5,274 samples
✅ Architecture valid: 9,188 params, 0.04MB
🚀 Training model...

Epoch 23: ReduceLROnPlateau reducing learning rate to 0.0005000000237487257.
Restoring model weights from the end of the best epoch: 49.
📊 Evaluating model...
⏱️  Measuring inference time...
📈 Results for Trial 41:
   Exact Match Accuracy: 0.942
   Average F1-Score: 0.981
   Parameters: 9,188
   Model Size: 0.04MB
   Inference Time: 30.00ms
   Combined Score: 0.841
[I 2025-10-16 14:04:49,409] Trial 41 finished with value: 0.8407751936339523 and parameters: {'num_conv_layers': 2, 'num_dense_layers': 1, 'conv_filters_0': 32, 'conv_kernel_0': 3, 'conv_activation_0': 'swish', 'use_bn_0': True, 'conv_dropout_0': 0.3, 'conv_filters_1': 32, 'conv_kernel_1': 5, 'conv_activation_1': 'relu', 'use_bn_1': True, 'conv_dropout_1': 0.1, 'pool_type_1': 'avg', 'global_pool': 'avg', 'dense_units_0': 96, 'dense_activation_0': 'relu', 'dense_dropout_0': 0.5}. Best is trial 31 with value: 0.84820224933687.
Best trial: 31. Best value: 0.848202:  42%|████████████████▍                      | 42/100 [18:30<17:30, 18.12s/it, 1110.75/3600 seconds]
🔍 Trial 42: Starting architecture search...
🔧 Applying data augmentation (factor: 3x)...
✅ Data augmentation completed: 1,758 → 5,274 samples
✅ Architecture valid: 9,188 params, 0.04MB
🚀 Training model...

Epoch 16: ReduceLROnPlateau reducing learning rate to 0.0005000000237487257.

Epoch 48: ReduceLROnPlateau reducing learning rate to 0.0002500000118743628.
Restoring model weights from the end of the best epoch: 49.
📊 Evaluating model...
⏱️  Measuring inference time...
📈 Results for Trial 42:
   Exact Match Accuracy: 0.934
   Average F1-Score: 0.985
   Parameters: 9,188
   Model Size: 0.04MB
   Inference Time: 28.98ms
   Combined Score: 0.835
